title,description,published date,url,publisher
"Apple plans to upgrade the App Store's search engine, and it might ... - The Verge","Apple plans to upgrade the App Store's search engine, and it might ...  The Verge","Sun, 01 Oct 2023 17:41:34 GMT",https://consent.google.com/m?continue=https://news.google.com/rss/articles/CBMiaGh0dHBzOi8vd3d3LnRoZXZlcmdlLmNvbS8yMDIzLzEwLzEvMjM4OTgyODAvYXBwbGUtZ29vZ2xlLXBlZ2FzdXMtc2VhcmNoLWVuZ2luZS1jb21wZXRpdGlvbi1nZW5lcmF0aXZlLWFp0gEA?oc%3D5&gl=DE&m=0&pc=n&cm=2&hl=en-US&src=1,"{'href': 'https://www.theverge.com', 'title': 'The Verge'}"
iPhone 15 owners report connection issues with Apple CarPlay ... - Tom's Guide,iPhone 15 owners report connection issues with Apple CarPlay ...  Tom's Guide,"Sun, 01 Oct 2023 17:37:56 GMT",https://consent.google.com/m?continue=https://news.google.com/rss/articles/CBMib2h0dHBzOi8vd3d3LnRvbXNndWlkZS5jb20vbmV3cy9pcGhvbmUtMTUtb3duZXJzLXJlcG9ydC1jb25uZWN0aW9uLWlzc3Vlcy13aXRoLWFwcGxlLWNhcnBsYXktd2hhdC13ZS1rbm93LXNvLWZhctIBAA?oc%3D5&gl=DE&m=0&pc=n&cm=2&hl=en-US&src=1,"{'href': 'https://www.tomsguide.com', 'title': ""Tom's Guide""}"
Big Apple Toastmasters offers enhancement opportunities | Free ... - ECM Publishers,Big Apple Toastmasters offers enhancement opportunities | Free ...  ECM Publishers,"Sun, 01 Oct 2023 17:27:00 GMT",https://consent.google.com/m?continue=https://news.google.com/rss/articles/CBMimgFodHRwczovL3d3dy5ob21ldG93bnNvdXJjZS5jb20vc3VuX3RoaXN3ZWVrL2ZyZWUvYmlnLWFwcGxlLXRvYXN0bWFzdGVycy1vZmZlcnMtZW5oYW5jZW1lbnQtb3Bwb3J0dW5pdGllcy9hcnRpY2xlXzc0ZGZhMzRlLTVlZWQtMTFlZS1hY2IxLTkzYjgyMmRlNGUxNC5odG1s0gEA?oc%3D5&gl=DE&m=0&pc=n&cm=2&hl=en-US&src=1,"{'href': 'https://www.hometownsource.com', 'title': 'ECM Publishers'}"
Get This 4-in-1 USB-C Charger for Apple Devices for $19.99 - Entrepreneur,Get This 4-in-1 USB-C Charger for Apple Devices for $19.99  Entrepreneur,"Sun, 01 Oct 2023 17:00:00 GMT",https://consent.google.com/m?continue=https://news.google.com/rss/articles/CBMib2h0dHBzOi8vd3d3LmVudHJlcHJlbmV1ci5jb20vc2NpZW5jZS10ZWNobm9sb2d5L2dldC10aGlzLTQtaW4tMS11c2ItYy1jaGFyZ2VyLWZvci1hcHBsZS1kZXZpY2VzLWZvci0xOTk5LzQ2Mjg2OdIBAA?oc%3D5&gl=DE&m=0&pc=n&cm=2&hl=en-US&src=1,"{'href': 'https://www.entrepreneur.com', 'title': 'Entrepreneur'}"
Apple Stock Is at 4-Month Lows and Looks Attractive to Value Investors - Nasdaq,Apple Stock Is at 4-Month Lows and Looks Attractive to Value Investors  Nasdaq,"Sun, 01 Oct 2023 16:57:00 GMT",https://consent.google.com/m?continue=https://news.google.com/rss/articles/CBMiZmh0dHBzOi8vd3d3Lm5hc2RhcS5jb20vYXJ0aWNsZXMvYXBwbGUtc3RvY2staXMtYXQtNC1tb250aC1sb3dzLWFuZC1sb29rcy1hdHRyYWN0aXZlLXRvLXZhbHVlLWludmVzdG9yc9IBAA?oc%3D5&gl=DE&m=0&pc=n&cm=2&hl=en-US&src=1,"{'href': 'https://www.nasdaq.com', 'title': 'Nasdaq'}"
COLUMN: Take your pick of apple varieties at local orchard - OrilliaMatters,COLUMN: Take your pick of apple varieties at local orchard  OrilliaMatters,"Sun, 01 Oct 2023 16:30:00 GMT",https://consent.google.com/m?continue=https://news.google.com/rss/articles/CBMia2h0dHBzOi8vd3d3Lm9yaWxsaWFtYXR0ZXJzLmNvbS9sb2NhbC1uZXdzL2NvbHVtbi10YWtlLXlvdXItcGljay1vZi1hcHBsZS12YXJpZXRpZXMtYXQtbG9jYWwtb3JjaGFyZC03NjE4NjUy0gEA?oc%3D5&gl=DE&m=0&pc=n&cm=2&hl=en-US&src=1,"{'href': 'https://www.orilliamatters.com', 'title': 'OrilliaMatters'}"
"Daily deals Oct. 1: AirPods Pro $199, $700 off M1 MacBook Pro, Echelon EX3 exercise bike $299, more - AppleInsider","Daily deals Oct. 1: AirPods Pro $199, $700 off M1 MacBook Pro, Echelon EX3 exercise bike $299, more  AppleInsider","Sun, 01 Oct 2023 16:29:44 GMT",https://consent.google.com/m?continue=https://news.google.com/rss/articles/CBMihgFodHRwczovL2FwcGxlaW5zaWRlci5jb20vYXJ0aWNsZXMvMjMvMTAvMDEvZGFpbHktZGVhbHMtb2N0LTEtYWlycG9kcy1wcm8tMTk5LTcwMC1vZmYtbTEtbWFjYm9vay1wcm8tZWNoZWxvbi1leDMtZXhlcmNpc2UtYmlrZS0yOTktbW9yZdIBiwFodHRwczovL2FwcGxlaW5zaWRlci5jb20vYXJ0aWNsZXMvMjMvMTAvMDEvZGFpbHktZGVhbHMtb2N0LTEtYWlycG9kcy1wcm8tMTk5LTcwMC1vZmYtbTEtbWFjYm9vay1wcm8tZWNoZWxvbi1leDMtZXhlcmNpc2UtYmlrZS0yOTktbW9yZS9hbXAv?oc%3D5&gl=DE&m=0&pc=n&cm=2&hl=en-US&src=1,"{'href': 'https://appleinsider.com', 'title': 'AppleInsider'}"
How To Quickly Share Your Location Using Your Apple Watch - SlashGear,How To Quickly Share Your Location Using Your Apple Watch  SlashGear,"Sun, 01 Oct 2023 16:15:50 GMT",https://consent.google.com/m?continue=https://news.google.com/rss/articles/CBMiSmh0dHBzOi8vd3d3LnNsYXNoZ2Vhci5jb20vMTQwNTM3MS9oYXB0aWMtdG91Y2gtc2VuZHMtbG9jYXRpb24tYXBwbGUtd2F0Y2gv0gEA?oc%3D5&gl=DE&m=0&pc=n&cm=2&hl=en-US&src=1,"{'href': 'https://www.slashgear.com', 'title': 'SlashGear'}"
Target Takes on Amazon Prime Big Deal Days With Sales on Apple ... - The Messenger,Target Takes on Amazon Prime Big Deal Days With Sales on Apple ...  The Messenger,"Sun, 01 Oct 2023 16:13:00 GMT",https://consent.google.com/m?continue=https://news.google.com/rss/articles/CBMiZWh0dHBzOi8vdGhlbWVzc2VuZ2VyLmNvbS9idXNpbmVzcy90YXJnZXQtdGFrZXMtb24tYW1hem9uLXByaW1lLWJpZy1kZWFsLWRheS13aXRoLXNhbGVzLW9uLWFwcGxlLWR5c29u0gEA?oc%3D5&gl=DE&m=0&pc=n&cm=2&hl=en-US&src=1,"{'href': 'https://themessenger.com', 'title': 'The Messenger'}"
Thousands of Apple customers complain latest iPhone models are overheating - The Manila Times,Thousands of Apple customers complain latest iPhone models are overheating  The Manila Times,"Sun, 01 Oct 2023 16:10:00 GMT",https://consent.google.com/m?continue=https://news.google.com/rss/articles/CBMikgFodHRwczovL3d3dy5tYW5pbGF0aW1lcy5uZXQvMjAyMy8xMC8wMi9idXNpbmVzcy9maW5hbmNpYWwtdGltZXMvdGhvdXNhbmRzLW9mLWFwcGxlLWN1c3RvbWVycy1jb21wbGFpbi1sYXRlc3QtaXBob25lLW1vZGVscy1hcmUtb3ZlcmhlYXRpbmcvMTkxMjc4MtIBlgFodHRwczovL3d3dy5tYW5pbGF0aW1lcy5uZXQvMjAyMy8xMC8wMi9idXNpbmVzcy9maW5hbmNpYWwtdGltZXMvdGhvdXNhbmRzLW9mLWFwcGxlLWN1c3RvbWVycy1jb21wbGFpbi1sYXRlc3QtaXBob25lLW1vZGVscy1hcmUtb3ZlcmhlYXRpbmcvMTkxMjc4Mi9hbXA?oc%3D5&gl=DE&m=0&pc=n&cm=2&hl=en-US&src=1,"{'href': 'https://www.manilatimes.net', 'title': 'The Manila Times'}"
1 Apple Chip Supplier the Market Has Given Up On -- Time to Buy ... - Nasdaq,1 Apple Chip Supplier the Market Has Given Up On -- Time to Buy ...  Nasdaq,"Sun, 01 Oct 2023 16:05:00 GMT",https://consent.google.com/m?continue=https://news.google.com/rss/articles/CBMibGh0dHBzOi8vd3d3Lm5hc2RhcS5jb20vYXJ0aWNsZXMvMS1hcHBsZS1jaGlwLXN1cHBsaWVyLXRoZS1tYXJrZXQtaGFzLWdpdmVuLXVwLW9uLXRpbWUtdG8tYnV5LWJlZm9yZS1pdC1zb2Fyc9IBAA?oc%3D5&gl=DE&m=0&pc=n&cm=2&hl=en-US&src=1,"{'href': 'https://www.nasdaq.com', 'title': 'Nasdaq'}"
Mark Zuckerberg wants Meta to be the Android of XR - Android Authority,Mark Zuckerberg wants Meta to be the Android of XR  Android Authority,"Sun, 01 Oct 2023 16:02:56 GMT",https://consent.google.com/m?continue=https://news.google.com/rss/articles/CBMiOWh0dHBzOi8vd3d3LmFuZHJvaWRhdXRob3JpdHkuY29tL21ldGEteHItb3Bpbmlvbi0zMzY5NDk4L9IBAA?oc%3D5&gl=DE&m=0&pc=n&cm=2&hl=en-US&src=1,"{'href': 'https://www.androidauthority.com', 'title': 'Android Authority'}"
Apple has won Three Design Patents in Hong Kong for 'Beats Studio ... - Patently Apple,Apple has won Three Design Patents in Hong Kong for 'Beats Studio ...  Patently Apple,"Sun, 01 Oct 2023 15:57:44 GMT",https://consent.google.com/m?continue=https://news.google.com/rss/articles/CBMicGh0dHBzOi8vd3d3LnBhdGVudGx5YXBwbGUuY29tLzIwMjMvMTAvYXBwbGUtaGFzLXdvbi10aHJlZS1kZXNpZ24tcGF0ZW50cy1pbi1ob25nLWtvbmctZm9yLWJlYXRzLXN0dWRpby1idWRzLmh0bWzSAQA?oc%3D5&gl=DE&m=0&pc=n&cm=2&hl=en-US&src=1,"{'href': 'https://www.patentlyapple.com', 'title': 'Patently Apple'}"
"Fuck It, It’s Apple Crisp Season - Defector","Fuck It, It’s Apple Crisp Season  Defector","Sun, 01 Oct 2023 15:45:00 GMT",https://consent.google.com/m?continue=https://news.google.com/rss/articles/CBMiM2h0dHBzOi8vZGVmZWN0b3IuY29tL2Z1Y2staXQtaXRzLWFwcGxlLWNyaXNwLXNlYXNvbtIBAA?oc%3D5&gl=DE&m=0&pc=n&cm=2&hl=en-US&src=1,"{'href': 'https://defector.com', 'title': 'Defector'}"
Apple has most of the elements it needs to create its own search engine - AppleInsider,Apple has most of the elements it needs to create its own search engine  AppleInsider,"Sun, 01 Oct 2023 15:37:52 GMT",https://consent.google.com/m?continue=https://news.google.com/rss/articles/CBMicmh0dHBzOi8vYXBwbGVpbnNpZGVyLmNvbS9hcnRpY2xlcy8yMy8xMC8wMS9hcHBsZS1oYXMtbW9zdC1vZi10aGUtZWxlbWVudHMtaXQtbmVlZHMtdG8tY3JlYXRlLWl0cy1vd24tc2VhcmNoLWVuZ2luZdIBd2h0dHBzOi8vYXBwbGVpbnNpZGVyLmNvbS9hcnRpY2xlcy8yMy8xMC8wMS9hcHBsZS1oYXMtbW9zdC1vZi10aGUtZWxlbWVudHMtaXQtbmVlZHMtdG8tY3JlYXRlLWl0cy1vd24tc2VhcmNoLWVuZ2luZS9hbXAv?oc%3D5&gl=DE&m=0&pc=n&cm=2&hl=en-US&src=1,"{'href': 'https://appleinsider.com', 'title': 'AppleInsider'}"
A Trillion-Dollar Dividend Growth Stock to Buy and Hold Forever - The Motley Fool,A Trillion-Dollar Dividend Growth Stock to Buy and Hold Forever  The Motley Fool,"Sun, 01 Oct 2023 15:18:00 GMT",https://consent.google.com/m?continue=https://news.google.com/rss/articles/CBMiXWh0dHBzOi8vd3d3LmZvb2wuY29tL2ludmVzdGluZy8yMDIzLzEwLzAxL2EtdHJpbGxpb24tZG9sbGFyLWRpdmlkZW5kLWdyb3d0aC1zdG9jay10by1idXktYW5kL9IBAA?oc%3D5&gl=DE&m=0&pc=n&cm=2&hl=en-US&src=1,"{'href': 'https://www.fool.com', 'title': 'The Motley Fool'}"
How to Track Your Running Progress Using Apple Watch - MUO - MakeUseOf,How to Track Your Running Progress Using Apple Watch  MUO - MakeUseOf,"Sun, 01 Oct 2023 15:00:00 GMT",https://consent.google.com/m?continue=https://news.google.com/rss/articles/CBMiPWh0dHBzOi8vd3d3Lm1ha2V1c2VvZi5jb20vdHJhY2stcnVubmluZy1wcm9ncmVzcy1hcHBsZS13YXRjaC_SAQA?oc%3D5&gl=DE&m=0&pc=n&cm=2&hl=en-US&src=1,"{'href': 'https://www.makeuseof.com', 'title': 'MUO - MakeUseOf'}"
Attract More Birds To Your Yard With One Tasty Item From Your Fruit ... - House Digest,Attract More Birds To Your Yard With One Tasty Item From Your Fruit ...  House Digest,"Sun, 01 Oct 2023 14:48:08 GMT",https://consent.google.com/m?continue=https://news.google.com/rss/articles/CBMiSmh0dHBzOi8vd3d3LmhvdXNlZGlnZXN0LmNvbS8xNDA4OTMwL2FwcGxlLWZydWl0LWF0dHJhY3QtYmlyZHMteWFyZC1nYXJkZW4v0gEA?oc%3D5&gl=DE&m=0&pc=n&cm=2&hl=en-US&src=1,"{'href': 'https://www.housedigest.com', 'title': 'House Digest'}"
Pegatron restarts iPhone production after factory fire in India - The Apple Post,Pegatron restarts iPhone production after factory fire in India  The Apple Post,"Sun, 01 Oct 2023 14:36:20 GMT",https://consent.google.com/m?continue=https://news.google.com/rss/articles/CBMiaGh0dHBzOi8vd3d3LnRoZWFwcGxlcG9zdC5jb20vMjAyMy8xMC8wMS9wZWdhdHJvbi1yZXN0YXJ0cy1pcGhvbmUtcHJvZHVjdGlvbi1hZnRlci1mYWN0b3J5LWZpcmUtaW4taW5kaWEv0gFsaHR0cHM6Ly93d3cudGhlYXBwbGVwb3N0LmNvbS8yMDIzLzEwLzAxL3BlZ2F0cm9uLXJlc3RhcnRzLWlwaG9uZS1wcm9kdWN0aW9uLWFmdGVyLWZhY3RvcnktZmlyZS1pbi1pbmRpYS9hbXAv?oc%3D5&gl=DE&m=0&pc=n&cm=2&hl=en-US&src=1,"{'href': 'https://www.theapplepost.com', 'title': 'The Apple Post'}"
Apple Valley RNs ratify new contract with improvements for patient ... - Victor Valley News - VVNG,Apple Valley RNs ratify new contract with improvements for patient ...  Victor Valley News - VVNG,"Sun, 01 Oct 2023 14:35:05 GMT",https://consent.google.com/m?continue=https://news.google.com/rss/articles/CBMic2h0dHBzOi8vd3d3LnZ2bmcuY29tL2FwcGxlLXZhbGxleS1ybnMtcmF0aWZ5LW5ldy1jb250cmFjdC13aXRoLWltcHJvdmVtZW50cy1mb3ItcGF0aWVudC1zYWZldHktYW5kLW51cnNlLXJldGVudGlvbi_SAQA?oc%3D5&gl=DE&m=0&pc=n&cm=2&hl=en-US&src=1,"{'href': 'https://www.vvng.com', 'title': 'Victor Valley News - VVNG'}"
Social Media Apps May Disappear From Apple's App Store in China - PCMag,Social Media Apps May Disappear From Apple's App Store in China  PCMag,"Sun, 01 Oct 2023 14:33:11 GMT",https://consent.google.com/m?continue=https://news.google.com/rss/articles/CBMiWWh0dHBzOi8vd3d3LnBjbWFnLmNvbS9uZXdzL3NvY2lhbC1tZWRpYS1hcHBzLW1heS1kaXNhcHBlYXItZnJvbS1hcHBsZXMtYXBwLXN0b3JlLWluLWNoaW5h0gEA?oc%3D5&gl=DE&m=0&pc=n&cm=2&hl=en-US&src=1,"{'href': 'https://www.pcmag.com', 'title': 'PCMag'}"
Look to the Big Apple for last-minute Week 4 adds - Yahoo Sports,Look to the Big Apple for last-minute Week 4 adds  Yahoo Sports,"Sun, 01 Oct 2023 14:16:22 GMT",https://consent.google.com/m?continue=https://news.google.com/rss/articles/CBMiQmh0dHBzOi8vc3BvcnRzLnlhaG9vLmNvbS9sb29rLWJpZy1hcHBsZS1sYXN0LW1pbnV0ZS0xNDE2MjI3ODAuaHRtbNIBSmh0dHBzOi8vc3BvcnRzLnlhaG9vLmNvbS9hbXBodG1sL2xvb2stYmlnLWFwcGxlLWxhc3QtbWludXRlLTE0MTYyMjc4MC5odG1s?oc%3D5&gl=DE&m=0&pc=n&cm=2&hl=en-US&src=1,"{'href': 'https://sports.yahoo.com', 'title': 'Yahoo Sports'}"
"How to Watch AEW WrestleDream 2023 Live on Roku, Fire TV, Apple TV, & More on October 1 - Cord Cutters News","How to Watch AEW WrestleDream 2023 Live on Roku, Fire TV, Apple TV, & More on October 1  Cord Cutters News","Sun, 01 Oct 2023 14:16:04 GMT",https://consent.google.com/m?continue=https://news.google.com/rss/articles/CBMib2h0dHBzOi8vY29yZGN1dHRlcnNuZXdzLmNvbS9ob3ctdG8td2F0Y2gtYWV3LXdyZXN0bGVkcmVhbS0yMDIzLWxpdmUtb24tcm9rdS1maXJlLXR2LWFwcGxlLXR2LW1vcmUtb24tb2N0b2Jlci0xL9IBdWh0dHBzOi8vY29yZGN1dHRlcnNuZXdzLmNvbS9ob3ctdG8td2F0Y2gtYWV3LXdyZXN0bGVkcmVhbS0yMDIzLWxpdmUtb24tcm9rdS1maXJlLXR2LWFwcGxlLXR2LW1vcmUtb24tb2N0b2Jlci0xLz9hbXA9MQ?oc%3D5&gl=DE&m=0&pc=n&cm=2&hl=en-US&src=1,"{'href': 'https://cordcuttersnews.com', 'title': 'Cord Cutters News'}"
Chicago fall festival: Lincoln Square Ravenswood's 36th annual 'Apple Fest' ushers in autumn - WLS-TV,Chicago fall festival: Lincoln Square Ravenswood's 36th annual 'Apple Fest' ushers in autumn  WLS-TV,"Sun, 01 Oct 2023 13:50:59 GMT",https://consent.google.com/m?continue=https://news.google.com/rss/articles/CBMiU2h0dHBzOi8vYWJjN2NoaWNhZ28uY29tL2FwcGxlLWZlc3QtbGluY29sbi1zcXVhcmUtcmF2ZW5zd29vZC0yMDIzLWNoaWNhZ28vMTM4NDQxODQv0gFXaHR0cHM6Ly9hYmM3Y2hpY2Fnby5jb20vYW1wL2FwcGxlLWZlc3QtbGluY29sbi1zcXVhcmUtcmF2ZW5zd29vZC0yMDIzLWNoaWNhZ28vMTM4NDQxODQv?oc%3D5&gl=DE&m=0&pc=n&cm=2&hl=en-US&src=1,"{'href': 'https://abc7chicago.com', 'title': 'WLS-TV'}"
North Side 'Apple Fest' ushers in autumn - The Citizen,North Side 'Apple Fest' ushers in autumn  The Citizen,"Sun, 01 Oct 2023 13:49:21 GMT",https://consent.google.com/m?continue=https://news.google.com/rss/articles/CBMieWh0dHBzOi8vYXVidXJucHViLmNvbS9wYXJ0bmVycy9jbm4vbm9ydGgtc2lkZS1hcHBsZS1mZXN0LXVzaGVycy1pbi1hdXR1bW4vdmlkZW9fZTAzODRjMzktNjczYy01NWJkLWFmNDAtYjUyOTdhMzM0NmFiLmh0bWzSAQA?oc%3D5&gl=DE&m=0&pc=n&cm=2&hl=en-US&src=1,"{'href': 'https://auburnpub.com', 'title': 'The Citizen'}"
Apple festival to mark 59 years this weekend | News ... - The Independent,Apple festival to mark 59 years this weekend | News ...  The Independent,"Sun, 01 Oct 2023 13:38:00 GMT",https://consent.google.com/m?continue=https://news.google.com/rss/articles/CBMihAFodHRwczovL3d3dy5kYWlseWluZGVwZW5kZW50LmNvbS9uZXdzL2FwcGxlLWZlc3RpdmFsLXRvLW1hcmstNTkteWVhcnMtdGhpcy13ZWVrZW5kL2FydGljbGVfNmUxMGI0NTAtNWVjZS0xMWVlLWFmOTEtM2YwYjU0NzU4OWY0Lmh0bWzSAQA?oc%3D5&gl=DE&m=0&pc=n&cm=2&hl=en-US&src=1,"{'href': 'https://www.dailyindependent.com', 'title': 'The Independent'}"
iOS Apple TV remote app home/tv button no longer functions - MacRumors,iOS Apple TV remote app home/tv button no longer functions  MacRumors,"Sun, 01 Oct 2023 13:34:12 GMT",https://consent.google.com/m?continue=https://news.google.com/rss/articles/CBMiaGh0dHBzOi8vZm9ydW1zLm1hY3J1bW9ycy5jb20vdGhyZWFkcy9pb3MtYXBwbGUtdHYtcmVtb3RlLWFwcC1ob21lLXR2LWJ1dHRvbi1uby1sb25nZXItZnVuY3Rpb25zLjI0MDU4MDkv0gEA?oc%3D5&gl=DE&m=0&pc=n&cm=2&hl=en-US&src=1,"{'href': 'https://forums.macrumors.com', 'title': 'MacRumors'}"
Moist and delicious: Apple cake with halva - Ynetnews,Moist and delicious: Apple cake with halva  Ynetnews,"Sun, 01 Oct 2023 13:33:53 GMT",https://consent.google.com/m?continue=https://news.google.com/rss/articles/CBMiMmh0dHBzOi8vd3d3LnluZXRuZXdzLmNvbS9jdWx0dXJlL2FydGljbGUvcmpheDd0aWU20gEA?oc%3D5&gl=DE&m=0&pc=n&cm=2&hl=en-US&src=1,"{'href': 'https://www.ynetnews.com', 'title': 'Ynetnews'}"
"Xiaomi's first car to support Apple CarPlay, surprising many - gizmochina","Xiaomi's first car to support Apple CarPlay, surprising many  gizmochina","Sun, 01 Oct 2023 13:28:45 GMT",https://consent.google.com/m?continue=https://news.google.com/rss/articles/CBMiXmh0dHBzOi8vd3d3Lmdpem1vY2hpbmEuY29tLzIwMjMvMTAvMDEveGlhb21pLWNhci1mZWF0dXJlcy1ibHVldG9vdGgtNTItYXBwbGUtY2FycGxheS1hbmQtbW9yZS_SAQA?oc%3D5&gl=DE&m=0&pc=n&cm=2&hl=en-US&src=1,"{'href': 'https://www.gizmochina.com', 'title': 'gizmochina'}"
Tim Cook calls spatial computing in Apple Vision Pro an 'aha moment' in a user's life - AppleInsider,Tim Cook calls spatial computing in Apple Vision Pro an 'aha moment' in a user's life  AppleInsider,"Sun, 01 Oct 2023 13:10:43 GMT",https://consent.google.com/m?continue=https://news.google.com/rss/articles/CBMifWh0dHBzOi8vYXBwbGVpbnNpZGVyLmNvbS9hcnRpY2xlcy8yMy8xMC8wMS90aW0tY29vay1jYWxscy1zcGF0aWFsLWNvbXB1dGluZy1pbi1hcHBsZS12aXNpb24tcHJvLWFuLWFoYS1tb21lbnQtaW4tYS11c2Vycy1saWZl0gGCAWh0dHBzOi8vYXBwbGVpbnNpZGVyLmNvbS9hcnRpY2xlcy8yMy8xMC8wMS90aW0tY29vay1jYWxscy1zcGF0aWFsLWNvbXB1dGluZy1pbi1hcHBsZS12aXNpb24tcHJvLWFuLWFoYS1tb21lbnQtaW4tYS11c2Vycy1saWZlL2FtcC8?oc%3D5&gl=DE&m=0&pc=n&cm=2&hl=en-US&src=1,"{'href': 'https://appleinsider.com', 'title': 'AppleInsider'}"
'Fingernails' coming to Apple TV+ in November - watch the trailer - Entertainment Focus,'Fingernails' coming to Apple TV+ in November - watch the trailer  Entertainment Focus,"Sun, 01 Oct 2023 13:07:39 GMT",https://consent.google.com/m?continue=https://news.google.com/rss/articles/CBMiaGh0dHBzOi8vZW50ZXJ0YWlubWVudC1mb2N1cy5jb20vMjAyMy8xMC8wMS9maW5nZXJuYWlscy1jb21pbmctdG8tYXBwbGUtdHYtaW4tbm92ZW1iZXItd2F0Y2gtdGhlLXRyYWlsZXIv0gEA?oc%3D5&gl=DE&m=0&pc=n&cm=2&hl=en-US&src=1,"{'href': 'https://entertainment-focus.com', 'title': 'Entertainment Focus'}"
How to use FaceTime on the Apple TV - MobileSyrup,How to use FaceTime on the Apple TV  MobileSyrup,"Sun, 01 Oct 2023 13:02:00 GMT",https://consent.google.com/m?continue=https://news.google.com/rss/articles/CBMiR2h0dHBzOi8vbW9iaWxlc3lydXAuY29tLzIwMjMvMTAvMDEvaG93LXRvLXVzZS1mYWNldGltZS1vbi10aGUtYXBwbGUtdHYv0gEA?oc%3D5&gl=DE&m=0&pc=n&cm=2&hl=en-US&src=1,"{'href': 'https://mobilesyrup.com', 'title': 'MobileSyrup'}"
"iPhone 15 Surprises, Apple Defends Google Deal, MacBook Air Bargain, Overheating Concerns And More: This - Benzinga","iPhone 15 Surprises, Apple Defends Google Deal, MacBook Air Bargain, Overheating Concerns And More: This  Benzinga","Sun, 01 Oct 2023 13:01:12 GMT",https://consent.google.com/m?continue=https://news.google.com/rss/articles/CBMikQFodHRwczovL3d3dy5iZW56aW5nYS5jb20vbmV3cy8yMy8xMC8zNTAyMDYzMS9pcGhvbmUtMTUtc3VycHJpc2VzLWFwcGxlLWRlZmVuZHMtZ29vZ2xlLWRlYWwtbWFjYm9vay1haXItYmFyZ2Fpbi1vdmVyaGVhdGluZy1jb25jZXJucy1hbmQtbW9yZS10aGlz0gEtaHR0cHM6Ly93d3cuYmVuemluZ2EuY29tL2FtcC9jb250ZW50LzM1MDIwNjMx?oc%3D5&gl=DE&m=0&pc=n&cm=2&hl=en-US&src=1,"{'href': 'https://www.benzinga.com', 'title': 'Benzinga'}"
5 great places for apple cider around Ann Arbor - MLive.com,5 great places for apple cider around Ann Arbor  MLive.com,"Sun, 01 Oct 2023 13:00:00 GMT",https://consent.google.com/m?continue=https://news.google.com/rss/articles/CBMiYWh0dHBzOi8vd3d3Lm1saXZlLmNvbS9uZXdzL2Fubi1hcmJvci8yMDIzLzEwLzUtZ3JlYXQtcGxhY2VzLWZvci1hcHBsZS1jaWRlci1hcm91bmQtYW5uLWFyYm9yLmh0bWzSAXBodHRwczovL3d3dy5tbGl2ZS5jb20vbmV3cy9hbm4tYXJib3IvMjAyMy8xMC81LWdyZWF0LXBsYWNlcy1mb3ItYXBwbGUtY2lkZXItYXJvdW5kLWFubi1hcmJvci5odG1sP291dHB1dFR5cGU9YW1w?oc%3D5&gl=DE&m=0&pc=n&cm=2&hl=en-US&src=1,"{'href': 'https://www.mlive.com', 'title': 'MLive.com'}"
"Apple Watch Series 10 rumors: Release date, price, features and ... - Laptop Mag","Apple Watch Series 10 rumors: Release date, price, features and ...  Laptop Mag","Sun, 01 Oct 2023 13:00:00 GMT",https://consent.google.com/m?continue=https://news.google.com/rss/articles/CBMiPGh0dHBzOi8vd3d3LmxhcHRvcG1hZy5jb20vc21hcnR3YXRjaGVzL2FwcGxlLXdhdGNoLXNlcmllcy0xMNIBAA?oc%3D5&gl=DE&m=0&pc=n&cm=2&hl=en-US&src=1,"{'href': 'https://www.laptopmag.com', 'title': 'Laptop Mag'}"
"Apple Music names Burna Boy, Wizkid, Davido, Rema, Asake ... - Premium Times","Apple Music names Burna Boy, Wizkid, Davido, Rema, Asake ...  Premium Times","Sun, 01 Oct 2023 12:50:13 GMT",https://consent.google.com/m?continue=https://news.google.com/rss/articles/CBMimQFodHRwczovL3d3dy5wcmVtaXVtdGltZXNuZy5jb20vZW50ZXJ0YWlubWVudC9tdXNpYy82Mjk3OTAtYXBwbGUtbXVzaWMtbmFtZXMtYnVybmEtYm95LXdpemtpZC1kYXZpZG8tcmVtYS1hc2FrZS1iaWdnZXN0LW5pZ2VyaWFuLWFydGlzdGVzLW9mLWFsbC10aW1lLmh0bWzSAQA?oc%3D5&gl=DE&m=0&pc=n&cm=2&hl=en-US&src=1,"{'href': 'https://www.premiumtimesng.com', 'title': 'Premium Times'}"
iPhone 16 Pro Max could be the largest Apple handset yet - Tom's Guide,iPhone 16 Pro Max could be the largest Apple handset yet  Tom's Guide,"Sun, 01 Oct 2023 12:47:06 GMT",https://consent.google.com/m?continue=https://news.google.com/rss/articles/CBMiV2h0dHBzOi8vd3d3LnRvbXNndWlkZS5jb20vbmV3cy9pcGhvbmUtMTYtcHJvLW1heC1jb3VsZC1iZS10aGUtbGFyZ2VzdC1hcHBsZS1oYW5kc2V0LXlldNIBAA?oc%3D5&gl=DE&m=0&pc=n&cm=2&hl=en-US&src=1,"{'href': 'https://www.tomsguide.com', 'title': ""Tom's Guide""}"
How do you like them apples? - Daily Herald,How do you like them apples?  Daily Herald,"Sun, 01 Oct 2023 12:21:39 GMT",https://consent.google.com/m?continue=https://news.google.com/rss/articles/CBMiSGh0dHBzOi8vd3d3LmRhaWx5aGVyYWxkLmNvbS9lbnRsaWZlLzIwMjMxMDAxL2hvdy1kby15b3UtbGlrZS10aGVtLWFwcGxlc9IBAA?oc%3D5&gl=DE&m=0&pc=n&cm=2&hl=en-US&src=1,"{'href': 'https://www.dailyherald.com', 'title': 'Daily Herald'}"
"Apple Pencil 3 Rumored To Arrive With Interchangeable, Magnetic Tips To Enable A Wide Range Of Creative Tasks - Wccftech","Apple Pencil 3 Rumored To Arrive With Interchangeable, Magnetic Tips To Enable A Wide Range Of Creative Tasks  Wccftech","Sun, 01 Oct 2023 12:15:00 GMT",https://consent.google.com/m?continue=https://news.google.com/rss/articles/CBMiQmh0dHBzOi8vd2NjZnRlY2guY29tL2FwcGxlLXBlbmNpbC10by1mZWF0dXJlLWludGVyY2hhbmdlYWJsZS10aXBzL9IBRmh0dHBzOi8vd2NjZnRlY2guY29tL2FwcGxlLXBlbmNpbC10by1mZWF0dXJlLWludGVyY2hhbmdlYWJsZS10aXBzL2FtcC8?oc%3D5&gl=DE&m=0&pc=n&cm=2&hl=en-US&src=1,"{'href': 'https://wccftech.com', 'title': 'Wccftech'}"
McDonald Peach Orchard in Apple Valley sells out in one day ... - VVdailypress.com,McDonald Peach Orchard in Apple Valley sells out in one day ...  VVdailypress.com,"Sun, 01 Oct 2023 12:00:24 GMT",https://consent.google.com/m?continue=https://news.google.com/rss/articles/CBMie2h0dHBzOi8vd3d3LnZ2ZGFpbHlwcmVzcy5jb20vc3RvcnkvbmV3cy8yMDIzLzEwLzAxL21jZG9uYWxkLXBlYWNoLW9yY2hhcmQtaW4tYXBwbGUtdmFsbGV5LXNlbGxzLW91dC1pbi1vbmUtZGF5LzcxMDI0Njc1MDA3L9IBAA?oc%3D5&gl=DE&m=0&pc=n&cm=2&hl=en-US&src=1,"{'href': 'https://www.vvdailypress.com', 'title': 'VVdailypress.com'}"
"Eric Akis: Chicken with apple, walnut dressing a hearty fall meal - Times Colonist","Eric Akis: Chicken with apple, walnut dressing a hearty fall meal  Times Colonist","Sun, 01 Oct 2023 11:40:00 GMT",https://consent.google.com/m?continue=https://news.google.com/rss/articles/CBMieWh0dHBzOi8vd3d3LnRpbWVzY29sb25pc3QuY29tL2xpZmUvZm9vZC1hbmQtZHJpbmsvZXJpYy1ha2lzLWNoaWNrZW4td2l0aC1hcHBsZS13YWxudXQtZHJlc3NpbmctYS1oZWFydHktZmFsbC1tZWFsLTc2MDcyMTjSAQA?oc%3D5&gl=DE&m=0&pc=n&cm=2&hl=en-US&src=1,"{'href': 'https://www.timescolonist.com', 'title': 'Times Colonist'}"
Apple's 3nm Chipset To See Reduced Demand In 2024: Ming-Chi Kuo - News18,Apple's 3nm Chipset To See Reduced Demand In 2024: Ming-Chi Kuo  News18,"Sun, 01 Oct 2023 11:10:41 GMT",https://consent.google.com/m?continue=https://news.google.com/rss/articles/CBMiWWh0dHBzOi8vd3d3Lm5ld3MxOC5jb20vdGVjaC9hcHBsZXMtM25tLWNoaXBzZXQtdG8tc2VlLXJlZHVjZWQtZGVtYW5kLWluLTIwMjQtODU5OTU0MS5odG1s0gFdaHR0cHM6Ly93d3cubmV3czE4LmNvbS9hbXAvdGVjaC9hcHBsZXMtM25tLWNoaXBzZXQtdG8tc2VlLXJlZHVjZWQtZGVtYW5kLWluLTIwMjQtODU5OTU0MS5odG1s?oc%3D5&gl=DE&m=0&pc=n&cm=2&hl=en-US&src=1,"{'href': 'https://www.news18.com', 'title': 'News18'}"
Everything we learned from Apple TV+’s The Super Models - Vogue France,Everything we learned from Apple TV+’s The Super Models  Vogue France,"Sun, 01 Oct 2023 11:06:27 GMT",https://consent.google.com/m?continue=https://news.google.com/rss/articles/CBMiUmh0dHBzOi8vd3d3LnZvZ3VlLmZyL2FydGljbGUvZXZlcnl0aGluZy13ZS1sZWFybmVkLWZyb20tYXBwbGUtdHZzLXRoZS1zdXBlci1tb2RlbHPSAVZodHRwczovL3d3dy52b2d1ZS5mci9hcnRpY2xlL2V2ZXJ5dGhpbmctd2UtbGVhcm5lZC1mcm9tLWFwcGxlLXR2cy10aGUtc3VwZXItbW9kZWxzL2FtcA?oc%3D5&gl=DE&m=0&pc=n&cm=2&hl=en-US&src=1,"{'href': 'https://www.vogue.fr', 'title': 'Vogue France'}"
"Google, Intel, Apple want to employ Kenyans – Ruto - The Star Kenya","Google, Intel, Apple want to employ Kenyans – Ruto  The Star Kenya ","Sun, 01 Oct 2023 11:06:01 GMT",https://consent.google.com/m?continue=https://news.google.com/rss/articles/CBMiWmh0dHBzOi8vd3d3LnRoZS1zdGFyLmNvLmtlL25ld3MvMjAyMy0xMC0wMS1nb29nbGUtaW50ZWwtYXBwbGUtd2FudC10by1lbXBsb3kta2VueWFucy1ydXRvL9IBAA?oc%3D5&gl=DE&m=0&pc=n&cm=2&hl=en-US&src=1,"{'href': 'https://www.the-star.co.ke', 'title': 'The Star Kenya'}"
Students encouraged to donate apples for a free drink in return - Epigram,Students encouraged to donate apples for a free drink in return  Epigram,"Sun, 01 Oct 2023 10:32:33 GMT",https://consent.google.com/m?continue=https://news.google.com/rss/articles/CBMiYmh0dHBzOi8vZXBpZ3JhbS5vcmcudWsvMjAyMy8xMC8wMS9zdHVkZW50cy1lbmNvdXJhZ2VkLXRvLWRvbmF0ZS1hcHBsZXMtZm9yLWEtZnJlZS1kcmluay1pbi1yZXR1cm4v0gFmaHR0cHM6Ly9lcGlncmFtLm9yZy51ay8yMDIzLzEwLzAxL3N0dWRlbnRzLWVuY291cmFnZWQtdG8tZG9uYXRlLWFwcGxlcy1mb3ItYS1mcmVlLWRyaW5rLWluLXJldHVybi9hbXAv?oc%3D5&gl=DE&m=0&pc=n&cm=2&hl=en-US&src=1,"{'href': 'https://epigram.org.uk', 'title': 'Epigram'}"
Apple Wallet May Soon Let You Check Your Bank Account Balance - PCMag,Apple Wallet May Soon Let You Check Your Bank Account Balance  PCMag,"Sun, 01 Oct 2023 10:17:16 GMT",https://consent.google.com/m?continue=https://news.google.com/rss/articles/CBMiWGh0dHBzOi8vd3d3LnBjbWFnLmNvbS9uZXdzL2FwcGxlLXdhbGxldC1tYXktc29vbi1sZXQteW91LWNoZWNrLXlvdXItYmFuay1hY2NvdW50LWJhbGFuY2XSAQA?oc%3D5&gl=DE&m=0&pc=n&cm=2&hl=en-US&src=1,"{'href': 'https://www.pcmag.com', 'title': 'PCMag'}"
