title,description,published date,url,publisher
Kate channels Steve Jobs while meeting Apple CEO Tim Cook - Sky News Australia,Kate channels Steve Jobs while meeting Apple CEO Tim Cook  Sky News Australia,"Mon, 02 Oct 2023 06:45:17 GMT",https://consent.google.com/m?continue=https://news.google.com/rss/articles/CBMiuAFodHRwczovL3d3dy5za3luZXdzLmNvbS5hdS93b3JsZC1uZXdzL2thdGUtbWlkZGxldG9uLWNoYW5uZWxzLXN0ZXZlLWpvYnMtaW4tdHVydGxlbmVjay13aGlsZS1tZWV0aW5nLWFwcGxlLWNlby10aW0tY29vay1hdC1idWNraW5naGFtLXBhbGFjZS9uZXdzLXN0b3J5LzA2ZWRlYmM5NzJmM2QxM2JmMTRmNjY4NTc5NjQ1Y2Qw0gG8AWh0dHBzOi8vd3d3LnNreW5ld3MuY29tLmF1L3dvcmxkLW5ld3Mva2F0ZS1taWRkbGV0b24tY2hhbm5lbHMtc3RldmUtam9icy1pbi10dXJ0bGVuZWNrLXdoaWxlLW1lZXRpbmctYXBwbGUtY2VvLXRpbS1jb29rLWF0LWJ1Y2tpbmdoYW0tcGFsYWNlL25ld3Mtc3RvcnkvMDZlZGViYzk3MmYzZDEzYmYxNGY2Njg1Nzk2NDVjZDA_YW1w?oc%3D5&gl=DE&m=0&pc=n&cm=2&hl=en-US&src=1,"{'href': 'https://www.skynews.com.au', 'title': 'Sky News Australia'}"
Apple Cider Vinegar Diet for Weight Loss: Worth It or Not? - Sportskeeda,Apple Cider Vinegar Diet for Weight Loss: Worth It or Not?  Sportskeeda,"Mon, 02 Oct 2023 06:28:00 GMT",https://consent.google.com/m?continue=https://news.google.com/rss/articles/CBMiYGh0dHBzOi8vd3d3LnNwb3J0c2tlZWRhLmNvbS9oZWFsdGgtYW5kLWZpdG5lc3MvYXBwbGUtY2lkZXItdmluZWdhci1kaWV0LXdlaWdodC1sb3NzLXdvcnRoLWl0LW5vdNIBZGh0dHBzOi8vd3d3LnNwb3J0c2tlZWRhLmNvbS9hbXAvaGVhbHRoLWFuZC1maXRuZXNzL2FwcGxlLWNpZGVyLXZpbmVnYXItZGlldC13ZWlnaHQtbG9zcy13b3J0aC1pdC1ub3Q?oc%3D5&gl=DE&m=0&pc=n&cm=2&hl=en-US&src=1,"{'href': 'https://www.sportskeeda.com', 'title': 'Sportskeeda'}"
iPhone 15 Pro Max review: Apple's flagship smartphone is full of surprises - Business Standard,iPhone 15 Pro Max review: Apple's flagship smartphone is full of surprises  Business Standard,"Mon, 02 Oct 2023 06:03:07 GMT",https://consent.google.com/m?continue=https://news.google.com/rss/articles/CBMilwFodHRwczovL3d3dy5idXNpbmVzcy1zdGFuZGFyZC5jb20vdGVjaG5vbG9neS90ZWNoLXJldmlld3MvaXBob25lLTE1LXByby1tYXgtcmV2aWV3LWFwcGxlLXMtZmxhZ3NoaXAtc21hcnRwaG9uZS1pcy1mdWxsLW9mLXN1cnByaXNlcy0xMjMxMDAyMDAyNDJfMS5odG1s0gGbAWh0dHBzOi8vd3d3LmJ1c2luZXNzLXN0YW5kYXJkLmNvbS9hbXAvdGVjaG5vbG9neS90ZWNoLXJldmlld3MvaXBob25lLTE1LXByby1tYXgtcmV2aWV3LWFwcGxlLXMtZmxhZ3NoaXAtc21hcnRwaG9uZS1pcy1mdWxsLW9mLXN1cnByaXNlcy0xMjMxMDAyMDAyNDJfMS5odG1s?oc%3D5&gl=DE&m=0&pc=n&cm=2&hl=en-US&src=1,"{'href': 'https://www.business-standard.com', 'title': 'Business Standard'}"
Aamodt's Apple Farm Fest ﻿ - Twin Cities Things To Do - Star Tribune,Aamodt's Apple Farm Fest ﻿ - Twin Cities Things To Do  Star Tribune,"Mon, 02 Oct 2023 05:43:52 GMT",https://consent.google.com/m?continue=https://news.google.com/rss/articles/CBMicmh0dHBzOi8vd3d3LnN0YXJ0cmlidW5lLmNvbS92YXJpZXR5L3RoaW5ncy10by1kby9jYWxlbmRhci9kZXRhaWxzL0FhbW9kdC1zLUFwcGxlLUZhcm0tRmVzdC0vMTIzMTU1NDMvMjAyMy0xMC0wMVQwMNIBAA?oc%3D5&gl=DE&m=0&pc=n&cm=2&hl=en-US&src=1,"{'href': 'https://www.startribune.com', 'title': 'Star Tribune'}"
'One of the best inventions Starbucks came up with.' Learn The ... - Twisted Sifter,'One of the best inventions Starbucks came up with.' Learn The ...  Twisted Sifter,"Mon, 02 Oct 2023 05:39:53 GMT",https://consent.google.com/m?continue=https://news.google.com/rss/articles/CBMiVGh0dHBzOi8vdHdpc3RlZHNpZnRlci5jb20vMjAyMy8xMC90aGUtYXBwbGUtY3JvaXNzYW50LWhhY2stZnJvbS1hLXN0YXJidWNrcy1tYW5hZ2VyL9IBAA?oc%3D5&gl=DE&m=0&pc=n&cm=2&hl=en-US&src=1,"{'href': 'https://twistedsifter.com', 'title': 'Twisted Sifter'}"
Why is Perthshire brewery Wasted Degrees offering free beer for ... - The Courier,Why is Perthshire brewery Wasted Degrees offering free beer for ...  The Courier,"Mon, 02 Oct 2023 05:00:33 GMT",https://consent.google.com/m?continue=https://news.google.com/rss/articles/CBMidWh0dHBzOi8vd3d3LnRoZWNvdXJpZXIuY28udWsvZnAvbGlmZXN0eWxlL2Zvb2QtZHJpbmsvNDc0MDA3Ni93YXN0ZWQtZGVncmVlcy1sYXNzLW9nb3dyaWUtcGVydGhzaGlyZS1hcHBsZS1jb2xsZWN0aW9uL9IBAA?oc%3D5&gl=DE&m=0&pc=n&cm=2&hl=en-US&src=1,"{'href': 'https://www.thecourier.co.uk', 'title': 'The Courier'}"
Curious tradition of apple throwing at Yorkshire's Newby Hall as ... - The Yorkshire Post,Curious tradition of apple throwing at Yorkshire's Newby Hall as ...  The Yorkshire Post,"Mon, 02 Oct 2023 05:00:00 GMT",https://consent.google.com/m?continue=https://news.google.com/rss/articles/CBMingFodHRwczovL3d3dy55b3Jrc2hpcmVwb3N0LmNvLnVrL2hlcml0YWdlLWFuZC1yZXRyby9oZXJpdGFnZS9jdXJpb3VzLXRyYWRpdGlvbi1vZi1hcHBsZS10aHJvd2luZy1hdC15b3Jrc2hpcmVzLW5ld2J5LWhhbGwtYXMtY2hhbXBpb25zaGlwLWdldHMtdW5kZXJ3YXktNDM1NTM3NNIBAA?oc%3D5&gl=DE&m=0&pc=n&cm=2&hl=en-US&src=1,"{'href': 'https://www.yorkshirepost.co.uk', 'title': 'The Yorkshire Post'}"
Kulgam techie enters Apple 'Hall of Fame' for data leak find - Daily Excelsior,Kulgam techie enters Apple 'Hall of Fame' for data leak find  Daily Excelsior,"Mon, 02 Oct 2023 04:40:29 GMT",https://consent.google.com/m?continue=https://news.google.com/rss/articles/CBMiWmh0dHBzOi8vd3d3LmRhaWx5ZXhjZWxzaW9yLmNvbS9rdWxnYW0tdGVjaGllLWVudGVycy1hcHBsZS1oYWxsLW9mLWZhbWUtZm9yLWRhdGEtbGVhay1maW5kL9IBAA?oc%3D5&gl=DE&m=0&pc=n&cm=2&hl=en-US&src=1,"{'href': 'https://www.dailyexcelsior.com', 'title': 'Daily Excelsior'}"
Apple says iPhone 15 overheating issues are due to iOS 17 bugs and third-party apps - Ghacks,Apple says iPhone 15 overheating issues are due to iOS 17 bugs and third-party apps  Ghacks,"Mon, 02 Oct 2023 04:35:16 GMT",https://consent.google.com/m?continue=https://news.google.com/rss/articles/CBMidmh0dHBzOi8vd3d3LmdoYWNrcy5uZXQvMjAyMy8xMC8wMi9hcHBsZS1zYXlzLWlwaG9uZS0xNS1vdmVyaGVhdGluZy1pc3N1ZXMtYXJlLWR1ZS10by1pb3MtMTctYnVncy1hbmQtdGhpcmQtcGFydHktYXBwcy_SAXpodHRwczovL3d3dy5naGFja3MubmV0LzIwMjMvMTAvMDIvYXBwbGUtc2F5cy1pcGhvbmUtMTUtb3ZlcmhlYXRpbmctaXNzdWVzLWFyZS1kdWUtdG8taW9zLTE3LWJ1Z3MtYW5kLXRoaXJkLXBhcnR5LWFwcHMvP2FtcA?oc%3D5&gl=DE&m=0&pc=n&cm=2&hl=en-US&src=1,"{'href': 'https://www.ghacks.net', 'title': 'Ghacks'}"
"Apple Watch Series 9 vs Apple Watch Series 8: Price, Specifications Compared - Gadgets 360","Apple Watch Series 9 vs Apple Watch Series 8: Price, Specifications Compared  Gadgets 360","Mon, 02 Oct 2023 04:30:01 GMT",https://consent.google.com/m?continue=https://news.google.com/rss/articles/CBMidmh0dHBzOi8vd3d3LmdhZGdldHMzNjAuY29tL3dlYXJhYmxlcy9uZXdzL2FwcGxlLXdhdGNoLXNlcmllcy05LXZzLXdhdGNoLXNlcmllcy04LXByaWNlLXNwZWNpZmljYXRpb25zLWNvbXBhcmVkLTQ0MzYyNDPSAXpodHRwczovL3d3dy5nYWRnZXRzMzYwLmNvbS93ZWFyYWJsZXMvbmV3cy9hcHBsZS13YXRjaC1zZXJpZXMtOS12cy13YXRjaC1zZXJpZXMtOC1wcmljZS1zcGVjaWZpY2F0aW9ucy1jb21wYXJlZC00NDM2MjQzL2FtcA?oc%3D5&gl=DE&m=0&pc=n&cm=2&hl=en-US&src=1,"{'href': 'https://www.gadgets360.com', 'title': 'Gadgets 360'}"
APPLE PICKING 2023 - Carly Riordan,APPLE PICKING 2023  Carly Riordan,"Mon, 02 Oct 2023 04:04:47 GMT",https://consent.google.com/m?continue=https://news.google.com/rss/articles/CBMiMGh0dHBzOi8vY2FybHlyaW9yZGFuLmNvbS9hcHBsZS1waWNraW5nLTIwMjMuaHRtbNIBAA?oc%3D5&gl=DE&m=0&pc=n&cm=2&hl=en-US&src=1,"{'href': 'https://carlyriordan.com', 'title': 'Carly Riordan'}"
"Pick Pumpkins, Pick Apples and Get Out of Town - The New York Times","Pick Pumpkins, Pick Apples and Get Out of Town  The New York Times","Mon, 02 Oct 2023 04:02:05 GMT",https://consent.google.com/m?continue=https://news.google.com/rss/articles/CBMiXmh0dHBzOi8vd3d3Lm55dGltZXMuY29tLzIwMjMvMTAvMDIvbnlyZWdpb24vcGljay1wdW1wa2lucy1waWNrLWFwcGxlcy1hbmQtZ2V0LW91dC1vZi10b3duLmh0bWzSAQA?oc%3D5&gl=DE&m=0&pc=n&cm=2&hl=en-US&src=1,"{'href': 'https://www.nytimes.com', 'title': 'The New York Times'}"
"More than just apples, Cleveland’s Apple Valley Orchards also ... - Chattanooga Times Free Press","More than just apples, Cleveland’s Apple Valley Orchards also ...  Chattanooga Times Free Press","Mon, 02 Oct 2023 04:01:00 GMT",https://consent.google.com/m?continue=https://news.google.com/rss/articles/CBMiXmh0dHBzOi8vd3d3LnRpbWVzZnJlZXByZXNzLmNvbS9uZXdzLzIwMjMvb2N0LzAyL21vcmUtdGhhbi1qdXN0LWFwcGxlcy1jbGV2ZWxhbmRzLWFwcGxlLXZhbGxleS_SAQA?oc%3D5&gl=DE&m=0&pc=n&cm=2&hl=en-US&src=1,"{'href': 'https://www.timesfreepress.com', 'title': 'Chattanooga Times Free Press'}"
Take a day trip to apple orchards near Chattanooga on these scenic ... - Chattanooga Times Free Press,Take a day trip to apple orchards near Chattanooga on these scenic ...  Chattanooga Times Free Press,"Mon, 02 Oct 2023 04:01:00 GMT",https://consent.google.com/m?continue=https://news.google.com/rss/articles/CBMiV2h0dHBzOi8vd3d3LnRpbWVzZnJlZXByZXNzLmNvbS9uZXdzLzIwMjMvb2N0LzAyL3Rha2UtYS1kYXktdHJpcC10by1hcHBsZS1vcmNoYXJkcy1uZWFyL9IBAA?oc%3D5&gl=DE&m=0&pc=n&cm=2&hl=en-US&src=1,"{'href': 'https://www.timesfreepress.com', 'title': 'Chattanooga Times Free Press'}"
Chiefs game report | Big lead evaporates in Big Apple as Pacheco ... - KSHB 41 Kansas City News,Chiefs game report | Big lead evaporates in Big Apple as Pacheco ...  KSHB 41 Kansas City News,"Mon, 02 Oct 2023 03:48:00 GMT",https://consent.google.com/m?continue=https://news.google.com/rss/articles/CBMiamh0dHBzOi8vd3d3LmtzaGIuY29tL3Nwb3J0cy9jaGllZnMtZ2FtZS1yZXBvcnQtYmlnLWxlYWQtZXZhcG9yYXRlcy1pbi1iaWctYXBwbGUtYXMtcGFjaGVjby1sZWFkcy0yMy0yMC13aW7SAQA?oc%3D5&gl=DE&m=0&pc=n&cm=2&hl=en-US&src=1,"{'href': 'https://www.kshb.com', 'title': 'KSHB 41 Kansas City News'}"
"Apple Acknowledges iPhone Heating Issues, Blames iOS 17 Bug And Third-party Apps - BW Businessworld","Apple Acknowledges iPhone Heating Issues, Blames iOS 17 Bug And Third-party Apps  BW Businessworld","Mon, 02 Oct 2023 03:36:23 GMT",https://consent.google.com/m?continue=https://news.google.com/rss/articles/CBMihwFodHRwczovL3d3dy5idXNpbmVzc3dvcmxkLmluL2FydGljbGUvQXBwbGUtQWNrbm93bGVkZ2VzLWlQaG9uZS1IZWF0aW5nLUlzc3Vlcy1CbGFtZXMtaU9TLTE3LUJ1Zy1BbmQtVGhpcmQtcGFydHktQXBwcy8wMi0xMC0yMDIzLTQ5MzQ1Mi_SAYYBaHR0cHM6Ly9idXNpbmVzc3dvcmxkLmluL2FtcC9hcnRpY2xlL0FwcGxlLUFja25vd2xlZGdlcy1pUGhvbmUtSGVhdGluZy1Jc3N1ZXMtQmxhbWVzLWlPUy0xNy1CdWctQW5kLVRoaXJkLXBhcnR5LUFwcHMvMDItMTAtMjAyMy00OTM0NTI?oc%3D5&gl=DE&m=0&pc=n&cm=2&hl=en-US&src=1,"{'href': 'https://www.businessworld.in', 'title': 'BW Businessworld'}"
People enjoy special champagne apple at Duluth palooza - Northern News Now,People enjoy special champagne apple at Duluth palooza  Northern News Now,"Mon, 02 Oct 2023 02:57:00 GMT",https://consent.google.com/m?continue=https://news.google.com/rss/articles/CBMiX2h0dHBzOi8vd3d3Lm5vcnRoZXJubmV3c25vdy5jb20vMjAyMy8xMC8wMi9wZW9wbGUtZW5qb3ktc3BlY2lhbC1jaGFtcGFnbmUtYXBwbGUtZHVsdXRoLXBhbG9vemEv0gFuaHR0cHM6Ly93d3cubm9ydGhlcm5uZXdzbm93LmNvbS8yMDIzLzEwLzAyL3Blb3BsZS1lbmpveS1zcGVjaWFsLWNoYW1wYWduZS1hcHBsZS1kdWx1dGgtcGFsb296YS8_b3V0cHV0VHlwZT1hbXA?oc%3D5&gl=DE&m=0&pc=n&cm=2&hl=en-US&src=1,"{'href': 'https://www.northernnewsnow.com', 'title': 'Northern News Now'}"
Heat helps keep attendance and cider sales high at Four Flags Area ... - ABC 57 News,Heat helps keep attendance and cider sales high at Four Flags Area ...  ABC 57 News,"Mon, 02 Oct 2023 02:44:00 GMT",https://consent.google.com/m?continue=https://news.google.com/rss/articles/CBMibGh0dHBzOi8vd3d3LmFiYzU3LmNvbS9uZXdzL2hlYXQtaGVscHMta2VlcC1hdHRlbmRhbmNlLWFuZC1jaWRlci1zYWxlcy1oaWdoLWF0LWZvdXItZmxhZ3MtYXJlYS1hcHBsZS1mZXN0aXZhbNIBAA?oc%3D5&gl=DE&m=0&pc=n&cm=2&hl=en-US&src=1,"{'href': 'https://www.abc57.com', 'title': 'ABC 57 News'}"
Blue and black iphone 15p/m display models scratched AF at the ... - MacRumors,Blue and black iphone 15p/m display models scratched AF at the ...  MacRumors,"Mon, 02 Oct 2023 02:29:51 GMT",https://consent.google.com/m?continue=https://news.google.com/rss/articles/CBMieGh0dHBzOi8vZm9ydW1zLm1hY3J1bW9ycy5jb20vdGhyZWFkcy9ibHVlLWFuZC1ibGFjay1pcGhvbmUtMTVwLW0tZGlzcGxheS1tb2RlbHMtc2NyYXRjaGVkLWFmLWF0LXRoZS1hcHBsZS1zdG9yZS4yNDA1ODc1L9IBAA?oc%3D5&gl=DE&m=0&pc=n&cm=2&hl=en-US&src=1,"{'href': 'https://forums.macrumors.com', 'title': 'MacRumors'}"
Applefest Brings Community Together Amid Weak Apple Harvest - Cornell University The Cornell Daily Sun,Applefest Brings Community Together Amid Weak Apple Harvest  Cornell University The Cornell Daily Sun,"Mon, 02 Oct 2023 01:58:22 GMT",https://consent.google.com/m?continue=https://news.google.com/rss/articles/CBMiXmh0dHBzOi8vY29ybmVsbHN1bi5jb20vMjAyMy8xMC8wMS9hcHBsZWZlc3QtYnJpbmdzLWNvbW11bml0eS10b2dldGhlci1hbWlkLXdlYWstYXBwbGUtaGFydmVzdC_SAQA?oc%3D5&gl=DE&m=0&pc=n&cm=2&hl=en-US&src=1,"{'href': 'https://cornellsun.com', 'title': 'Cornell University The Cornell Daily Sun'}"
Apple Reportedly Making Push For Global Formula 1 Rights - Front Office Sports,Apple Reportedly Making Push For Global Formula 1 Rights  Front Office Sports,"Mon, 02 Oct 2023 01:19:15 GMT",https://consent.google.com/m?continue=https://news.google.com/rss/articles/CBMiV2h0dHBzOi8vZnJvbnRvZmZpY2VzcG9ydHMuY29tL2FwcGxlLXJlcG9ydGVkbHktbWFraW5nLXB1c2gtZm9yLWdsb2JhbC1mb3JtdWxhLTEtcmlnaHRzL9IBAA?oc%3D5&gl=DE&m=0&pc=n&cm=2&hl=en-US&src=1,"{'href': 'https://frontofficesports.com', 'title': 'Front Office Sports'}"
"Tehachapi Apple Festival, chamber carnival and ‘raincheck rodeo’ among upcoming events - Tehachapi News","Tehachapi Apple Festival, chamber carnival and ‘raincheck rodeo’ among upcoming events  Tehachapi News","Mon, 02 Oct 2023 01:00:00 GMT",https://consent.google.com/m?continue=https://news.google.com/rss/articles/CBMirQFodHRwczovL3d3dy50ZWhhY2hhcGluZXdzLmNvbS9saWZlc3R5bGUvdGVoYWNoYXBpLWFwcGxlLWZlc3RpdmFsLWNoYW1iZXItY2Fybml2YWwtYW5kLXJhaW5jaGVjay1yb2Rlby1hbW9uZy11cGNvbWluZy1ldmVudHMvYXJ0aWNsZV9hZjFjYmY2NC01ZmQ0LTExZWUtYjgyYy0yMzg5YWUxOWU0YmEuaHRtbNIBsQFodHRwczovL3d3dy50ZWhhY2hhcGluZXdzLmNvbS9saWZlc3R5bGUvdGVoYWNoYXBpLWFwcGxlLWZlc3RpdmFsLWNoYW1iZXItY2Fybml2YWwtYW5kLXJhaW5jaGVjay1yb2Rlby1hbW9uZy11cGNvbWluZy1ldmVudHMvYXJ0aWNsZV9hZjFjYmY2NC01ZmQ0LTExZWUtYjgyYy0yMzg5YWUxOWU0YmEuYW1wLmh0bWw?oc%3D5&gl=DE&m=0&pc=n&cm=2&hl=en-US&src=1,"{'href': 'https://www.tehachapinews.com', 'title': 'Tehachapi News'}"
Local News: Annie Pegg crowned 2023 Apple Festival Queen (10/1 ... - Greene County Daily World,Local News: Annie Pegg crowned 2023 Apple Festival Queen (10/1 ...  Greene County Daily World,"Mon, 02 Oct 2023 00:56:16 GMT",https://consent.google.com/m?continue=https://news.google.com/rss/articles/CBMiL2h0dHBzOi8vd3d3LmdjZGFpbHl3b3JsZC5jb20vc3RvcnkvMzAxMjA1Ni5odG1s0gEA?oc%3D5&gl=DE&m=0&pc=n&cm=2&hl=en-US&src=1,"{'href': 'https://www.gcdailyworld.com', 'title': 'Greene County Daily World'}"
PHOTOS: Unforgettable day at the Southington Apple Harvest Festival - Meriden Record-Journal,PHOTOS: Unforgettable day at the Southington Apple Harvest Festival  Meriden Record-Journal,"Mon, 02 Oct 2023 00:44:00 GMT",https://consent.google.com/m?continue=https://news.google.com/rss/articles/CBMinAFodHRwczovL3d3dy5teXJlY29yZGpvdXJuYWwuY29tL05ld3MvU291dGhpbmd0b24vU291dGhpbmd0b24tTmV3cy9JbmNyZWRpYmxlLWltYWdlcy1mcm9tLWFuLXVuZm9yZ2V0dGFibGUtZGF5LWF0LXRoZS1Tb3V0aGluZ3Rvbi1BcHBsZS1IYXJ2ZXN0LUZlc3RpdmFsLmh0bWzSAQA?oc%3D5&gl=DE&m=0&pc=n&cm=2&hl=en-US&src=1,"{'href': 'https://www.myrecordjournal.com', 'title': 'Meriden Record-Journal'}"
"Taylor Swift, Sophie Turner, Ryan Reynolds attend Chiefs-Jets - ESPN - ESPN","Taylor Swift, Sophie Turner, Ryan Reynolds attend Chiefs-Jets - ESPN  ESPN","Mon, 02 Oct 2023 00:30:00 GMT",https://consent.google.com/m?continue=https://news.google.com/rss/articles/CBMiY2h0dHBzOi8vd3d3LmVzcG4uY29tL25mbC9zdG9yeS9fL2lkLzM4NTQzNTQ5L3N1bmRheS1uaWdodC1mb290YmFsbC10YXlsb3Itc3dpZnQtdHJhdmlzLWtlbGNlLWNoaWVmc9IBcGh0dHBzOi8vd3d3LmVzcG4uY29tL25mbC9zdG9yeS9fL2lkLzM4NTQzNTQ5L3N1bmRheS1uaWdodC1mb290YmFsbC10YXlsb3Itc3dpZnQtdHJhdmlzLWtlbGNlLWNoaWVmcz9wbGF0Zm9ybT1hbXA?oc%3D5&gl=DE&m=0&pc=n&cm=2&hl=en-US&src=1,"{'href': 'https://www.espn.com', 'title': 'ESPN'}"
Strong finish to first weekend of Southington Apple Harvest Festival - Meriden Record-Journal,Strong finish to first weekend of Southington Apple Harvest Festival  Meriden Record-Journal,"Mon, 02 Oct 2023 00:22:00 GMT",https://consent.google.com/m?continue=https://news.google.com/rss/articles/CBMiemh0dHBzOi8vd3d3Lm15cmVjb3Jkam91cm5hbC5jb20vTmV3cy9Tb3V0aGluZ3Rvbi9Tb3V0aGluZ3Rvbi1OZXdzL0FwcGxlLUhhcnZlc3QtRmVzdGl2YWwtZHJhd3MtaW4tYmlnLWNyb3dzLW9uLVN1bmRheS5odG1s0gEA?oc%3D5&gl=DE&m=0&pc=n&cm=2&hl=en-US&src=1,"{'href': 'https://www.myrecordjournal.com', 'title': 'Meriden Record-Journal'}"
Apple Explored Replacing Google Not Only with Bing but Also ... - WinBuzzer,Apple Explored Replacing Google Not Only with Bing but Also ...  WinBuzzer,"Fri, 06 Oct 2023 11:10:26 GMT",https://consent.google.com/m?continue=https://news.google.com/rss/articles/CBMib2h0dHBzOi8vd2luYnV6emVyLmNvbS8yMDIzLzEwLzA2L2FwcGxlLWV4cGxvcmVkLXJlcGxhY2luZy1nb29nbGUtbm90LW9ubHktd2l0aC1iaW5nLWJ1dC1hbHNvLWR1Y2tkdWNrZ28teGN4d2JuL9IBAA?oc%3D5&gl=DE&m=0&pc=n&cm=2&hl=en-US&src=1,"{'href': 'https://winbuzzer.com', 'title': 'WinBuzzer'}"
11 Best Apple Keyboard With Trackpad For 2023 - Robots.net,11 Best Apple Keyboard With Trackpad For 2023  Robots.net,"Fri, 06 Oct 2023 11:07:07 GMT",https://consent.google.com/m?continue=https://news.google.com/rss/articles/CBMiRmh0dHBzOi8vcm9ib3RzLm5ldC90ZWNoLzExLWJlc3QtYXBwbGUta2V5Ym9hcmQtd2l0aC10cmFja3BhZC1mb3ItMjAyMy_SAQA?oc%3D5&gl=DE&m=0&pc=n&cm=2&hl=en-US&src=1,"{'href': 'https://robots.net', 'title': 'Robots.net'}"
Northland Nature: Hornets are a delight to watch - Duluth News Tribune,Northland Nature: Hornets are a delight to watch  Duluth News Tribune,"Fri, 06 Oct 2023 11:02:56 GMT",https://consent.google.com/m?continue=https://news.google.com/rss/articles/CBMia2h0dHBzOi8vd3d3LmR1bHV0aG5ld3N0cmlidW5lLmNvbS9zcG9ydHMvbm9ydGhsYW5kLW91dGRvb3JzL25vcnRobGFuZC1uYXR1cmUtaG9ybmV0cy1hcmUtYS1kZWxpZ2h0LXRvLXdhdGNo0gEA?oc%3D5&gl=DE&m=0&pc=n&cm=2&hl=en-US&src=1,"{'href': 'https://www.duluthnewstribune.com', 'title': 'Duluth News Tribune'}"
Apple Vision Pro headset to support screen mirroring via AirPlay - The Hans India,Apple Vision Pro headset to support screen mirroring via AirPlay  The Hans India,"Fri, 06 Oct 2023 11:02:33 GMT",https://consent.google.com/m?continue=https://news.google.com/rss/articles/CBMieWh0dHBzOi8vd3d3LnRoZWhhbnNpbmRpYS5jb20vdGVjaG5vbG9neS90ZWNoLW5ld3MvYXBwbGUtdmlzaW9uLXByby1oZWFkc2V0LXRvLXN1cHBvcnQtc2NyZWVuLW1pcnJvcmluZy12aWEtYWlycGxheS04Mjc5ODfSAQA?oc%3D5&gl=DE&m=0&pc=n&cm=2&hl=en-US&src=1,"{'href': 'https://www.thehansindia.com', 'title': 'The Hans India'}"
Minnesota Zoo earns accreditation - Star Tribune,Minnesota Zoo earns accreditation  Star Tribune,"Fri, 06 Oct 2023 11:01:27 GMT",https://consent.google.com/m?continue=https://news.google.com/rss/articles/CBMiSGh0dHBzOi8vd3d3LnN0YXJ0cmlidW5lLmNvbS9taW5uZXNvdGEtem9vLWVhcm5zLWFjY3JlZGl0YXRpb24vNjAwMzEwMjQ2L9IBAA?oc%3D5&gl=DE&m=0&pc=n&cm=2&hl=en-US&src=1,"{'href': 'https://www.startribune.com', 'title': 'Star Tribune'}"
"Apple iPhone SE 4 Rumors: USB-C, OLED, Face ID, and More - SAMAA","Apple iPhone SE 4 Rumors: USB-C, OLED, Face ID, and More  SAMAA","Fri, 06 Oct 2023 10:58:48 GMT",https://consent.google.com/m?continue=https://news.google.com/rss/articles/CBMiU2h0dHBzOi8vd3d3LnNhbWFhLnR2LzIwODczMjIxNS1hcHBsZS1pcGhvbmUtc2UtNC1ydW1vcnMtdXNiLWMtb2xlZC1mYWNlLWlkLWFuZC1tb3Jl0gEA?oc%3D5&gl=DE&m=0&pc=n&cm=2&hl=en-US&src=1,"{'href': 'https://www.samaa.tv', 'title': 'SAMAA'}"
Apple iPhone 15 Review - TrustedReviews,Apple iPhone 15 Review  TrustedReviews,"Fri, 06 Oct 2023 10:58:39 GMT",https://consent.google.com/m?continue=https://news.google.com/rss/articles/CBMiNmh0dHBzOi8vd3d3LnRydXN0ZWRyZXZpZXdzLmNvbS9yZXZpZXdzL2FwcGxlLWlwaG9uZS0xNdIBAA?oc%3D5&gl=DE&m=0&pc=n&cm=2&hl=en-US&src=1,"{'href': 'https://www.trustedreviews.com', 'title': 'TrustedReviews'}"
A weekend filled with 'all things apple' kicks off in Adams County | Travel Smart - WPMT FOX 43,A weekend filled with 'all things apple' kicks off in Adams County | Travel Smart  WPMT FOX 43,"Fri, 06 Oct 2023 10:54:00 GMT",https://consent.google.com/m?continue=https://news.google.com/rss/articles/CBMimQFodHRwczovL3d3dy5mb3g0My5jb20vYXJ0aWNsZS90cmF2ZWwvd2Vla2VuZC1vZi1hcHBsZXMtYWRhbXMtY291bnR5LW5hdGlvbmFsLWFwcGxlLWhhcnZlc3QtZmVzdGl2YWwtdHJhdmVsLXNtYXJ0LzUyMS0xZWEzMDM4NC00MjlmLTQwYjItODVhZi1mNzY2ODg1ZWMwODXSAZ0BaHR0cHM6Ly93d3cuZm94NDMuY29tL2FtcC9hcnRpY2xlL3RyYXZlbC93ZWVrZW5kLW9mLWFwcGxlcy1hZGFtcy1jb3VudHktbmF0aW9uYWwtYXBwbGUtaGFydmVzdC1mZXN0aXZhbC10cmF2ZWwtc21hcnQvNTIxLTFlYTMwMzg0LTQyOWYtNDBiMi04NWFmLWY3NjY4ODVlYzA4NQ?oc%3D5&gl=DE&m=0&pc=n&cm=2&hl=en-US&src=1,"{'href': 'https://www.fox43.com', 'title': 'WPMT FOX 43'}"
Thermal test shows that Apple fixed the iPhone 15 Pro overheating ... - BGR,Thermal test shows that Apple fixed the iPhone 15 Pro overheating ...  BGR,"Fri, 06 Oct 2023 10:50:00 GMT",https://consent.google.com/m?continue=https://news.google.com/rss/articles/CBMiVWh0dHBzOi8vYmdyLmNvbS90ZWNoL3RoZXJtYWwtdGVzdC1zaG93cy10aGUtaXBob25lLTE1LXByby1vdmVyaGVhdGluZy1maXgtaXMtd29ya2luZy_SAQA?oc%3D5&gl=DE&m=0&pc=n&cm=2&hl=en-US&src=1,"{'href': 'https://bgr.com', 'title': 'BGR'}"
Will Apple Unveil New iPads in 2023? Here's Your October Rumor ... - MacRumors,Will Apple Unveil New iPads in 2023? Here's Your October Rumor ...  MacRumors,"Fri, 06 Oct 2023 10:46:41 GMT",https://consent.google.com/m?continue=https://news.google.com/rss/articles/CBMiTGh0dHBzOi8vd3d3Lm1hY3J1bW9ycy5jb20vMjAyMy8xMC8wNi93aWxsLWFwcGxlLXJlbGVhc2UtbmV3LWlwYWRzLXRoaXMteWVhci_SAQA?oc%3D5&gl=DE&m=0&pc=n&cm=2&hl=en-US&src=1,"{'href': 'https://www.macrumors.com', 'title': 'MacRumors'}"
"South Korean regulator mulls potential fines on Apple, Google over ... - Seeking Alpha","South Korean regulator mulls potential fines on Apple, Google over ...  Seeking Alpha","Fri, 06 Oct 2023 10:34:56 GMT",https://consent.google.com/m?continue=https://news.google.com/rss/articles/CBMi3AFodHRwczovL3NlZWtpbmdhbHBoYS5jb20vbmV3cy80MDE4ODUxLXNvdXRoLWtvcmVhbi1yZWd1bGF0b3ItbXVsbHMtcG90ZW50aWFsLWZpbmVzLW9uLWFwcGxlLWdvb2dsZS1vdmVyLWFwcC1tYXJrZXQ_c291cmNlPWNvbnRlbnRfdHlwZSUzQXJlYWN0JTdDZmlyc3RfbGV2ZWxfdXJsJTNBbWFya2V0LW5ld3MlN0NzZWN0aW9uX2Fzc2V0JTNBbWFpbiU3Q3NlY3Rpb24lM0F0ZWNobm9sb2d50gEA?oc%3D5&gl=DE&m=0&pc=n&cm=2&hl=en-US&src=1,"{'href': 'https://seekingalpha.com', 'title': 'Seeking Alpha'}"
"Flipkart Big Billion Days Sale 2023: Apple iPhone 14 Pro Rs 2901 cheaper than Apple iPhone 15, check details - DNA India","Flipkart Big Billion Days Sale 2023: Apple iPhone 14 Pro Rs 2901 cheaper than Apple iPhone 15, check details  DNA India","Fri, 06 Oct 2023 10:32:00 GMT",https://consent.google.com/m?continue=https://news.google.com/rss/articles/CBMinQFodHRwczovL3d3dy5kbmFpbmRpYS5jb20vdGVjaG5vbG9neS9yZXBvcnQtZmxpcGthcnQtYmlnLWJpbGxpb24tZGF5cy1zYWxlLTIwMjMtYXBwbGUtaXBob25lLTE0LXByby1ycy0yOTAxLWNoZWFwZXItdGhhbi1hcHBsZS1pcGhvbmUtMTUtY2hlY2stZGV0YWlscy0zMDYzMjUy0gGhAWh0dHBzOi8vd3d3LmRuYWluZGlhLmNvbS90ZWNobm9sb2d5L3JlcG9ydC1mbGlwa2FydC1iaWctYmlsbGlvbi1kYXlzLXNhbGUtMjAyMy1hcHBsZS1pcGhvbmUtMTQtcHJvLXJzLTI5MDEtY2hlYXBlci10aGFuLWFwcGxlLWlwaG9uZS0xNS1jaGVjay1kZXRhaWxzLTMwNjMyNTIvYW1w?oc%3D5&gl=DE&m=0&pc=n&cm=2&hl=en-US&src=1,"{'href': 'https://www.dnaindia.com', 'title': 'DNA India'}"
"Weekend: Apple, cabbage, pirohy festivities are a foodie's dream ... - The Slovak Spectator","Weekend: Apple, cabbage, pirohy festivities are a foodie's dream ...  The Slovak Spectator","Fri, 06 Oct 2023 10:31:51 GMT",https://consent.google.com/m?continue=https://news.google.com/rss/articles/CBMib2h0dHBzOi8vc3BlY3RhdG9yLnNtZS5zay9jLzIzMjI2OTA4L3dlZWtlbmQtYXBwbGUtY2FiYmFnZS1waXJvaHktZmVzdGl2aXRpZXMtYXJlLWEtZm9vZGllcy1kcmVhbS1jb21lLXRydWUuaHRtbNIBAA?oc%3D5&gl=DE&m=0&pc=n&cm=2&hl=en-US&src=1,"{'href': 'https://spectator.sme.sk', 'title': 'The Slovak Spectator'}"
Apple cider whoopie pies will be your new favorite fall dessert - ABC 10 News San Diego KGTV,Apple cider whoopie pies will be your new favorite fall dessert  ABC 10 News San Diego KGTV,"Fri, 06 Oct 2023 10:30:00 GMT",https://consent.google.com/m?continue=https://news.google.com/rss/articles/CBMiVmh0dHBzOi8vd3d3LjEwbmV3cy5jb20vYXBwbGUtY2lkZXItd2hvb3BpZS1waWVzLXdpbGwtYmUteW91ci1uZXctZmF2b3JpdGUtZmFsbC1kZXNzZXJ00gEA?oc%3D5&gl=DE&m=0&pc=n&cm=2&hl=en-US&src=1,"{'href': 'https://www.10news.com', 'title': 'ABC 10 News San Diego KGTV'}"
Samsung also plans to follow Apple design for another key S24 ... - T3,Samsung also plans to follow Apple design for another key S24 ...  T3,"Fri, 06 Oct 2023 10:28:00 GMT",https://consent.google.com/m?continue=https://news.google.com/rss/articles/CBMiXWh0dHBzOi8vd3d3LnQzLmNvbS9uZXdzL3NhbXN1bmctYWxzby1wbGFucy10by1mb2xsb3ctYXBwbGUtZGVzaWduLWZvci1hbm90aGVyLWtleS1zMjQtZmVhdHVyZdIBAA?oc%3D5&gl=DE&m=0&pc=n&cm=2&hl=en-US&src=1,"{'href': 'https://www.t3.com', 'title': 'T3'}"
Is Apple Watch Ultra 2 worth buying in India? Review in 5 points - India Today,Is Apple Watch Ultra 2 worth buying in India? Review in 5 points  India Today,"Fri, 06 Oct 2023 10:24:28 GMT",https://consent.google.com/m?continue=https://news.google.com/rss/articles/CBMihgFodHRwczovL3d3dy5pbmRpYXRvZGF5LmluL3RlY2hub2xvZ3kvZmVhdHVyZXMvc3RvcnkvaXMtYXBwbGUtd2F0Y2gtdWx0cmEtMi13b3J0aC1idXlpbmctaW4taW5kaWEtcmV2aWV3LWluLTUtcG9pbnRzLTI0NDU0NjQtMjAyMy0xMC0wNtIBigFodHRwczovL3d3dy5pbmRpYXRvZGF5LmluL2FtcC90ZWNobm9sb2d5L2ZlYXR1cmVzL3N0b3J5L2lzLWFwcGxlLXdhdGNoLXVsdHJhLTItd29ydGgtYnV5aW5nLWluLWluZGlhLXJldmlldy1pbi01LXBvaW50cy0yNDQ1NDY0LTIwMjMtMTAtMDY?oc%3D5&gl=DE&m=0&pc=n&cm=2&hl=en-US&src=1,"{'href': 'https://www.indiatoday.in', 'title': 'India Today'}"
Early Apple Investor And Veteran VC Alan Patricof Warns Against AI Hype: 'Let's Tune In 12 Or 24 Months F - Benzinga,Early Apple Investor And Veteran VC Alan Patricof Warns Against AI Hype: 'Let's Tune In 12 Or 24 Months F  Benzinga,"Fri, 06 Oct 2023 10:20:59 GMT",https://consent.google.com/m?continue=https://news.google.com/rss/articles/CBMikQFodHRwczovL3d3dy5iZW56aW5nYS5jb20vbmV3cy8yMy8xMC8zNTEyMjkyNC9lYXJseS1hcHBsZS1pbnZlc3Rvci1hbmQtdmV0ZXJhbi12Yy1hbGFuLXBhdHJpY29mLXdhcm5zLWFnYWluc3QtYWktaHlwZS1sZXRzLXR1bmUtaW4tMTItb3ItMjQtbW9udGhz0gEtaHR0cHM6Ly93d3cuYmVuemluZ2EuY29tL2FtcC9jb250ZW50LzM1MTIyOTI0?oc%3D5&gl=DE&m=0&pc=n&cm=2&hl=en-US&src=1,"{'href': 'https://www.benzinga.com', 'title': 'Benzinga'}"
