title,description,published date,url,publisher,date
Link Tank: Why Orcs Must Die! 3 Is the Best Google Stadia Has to ... - Den of Geek,Link Tank: Why Orcs Must Die! 3 Is the Best Google Stadia Has to ...  Den of Geek,"Tue, 28 Jul 2020 07:00:00 GMT",https://news.google.com/rss/articles/CBMiT2h0dHBzOi8vd3d3LmRlbm9mZ2Vlay5jb20vY3VsdHVyZS9saW5rLXRhbmstb3Jjcy1tdXN0LWRpZS0zLWJlc3QtZ29vZ2xlLXN0YWRpYS_SAQA?oc=5&hl=en-US&gl=US&ceid=US:en,"{'href': 'https://www.denofgeek.com', 'title': 'Den of Geek'}",2020-07-28
How to see traffic for subdomains in Google Analytics - Digital Boom,How to see traffic for subdomains in Google Analytics  Digital Boom,"Tue, 28 Jul 2020 07:00:00 GMT",https://news.google.com/rss/articles/CBMiT2h0dHBzOi8vYWRpZ2l0YWxib29tLmNvbS9ob3ctdG8tc2VlLXRyYWZmaWMtZm9yLXN1YmRvbWFpbnMtaW4tZ29vZ2xlLWFuYWx5dGljcy_SAQA?oc=5&hl=en-US&gl=US&ceid=US:en,"{'href': 'https://adigitalboom.com', 'title': 'Digital Boom'}",2020-07-28
Google working on smart tattoos that turn skin into living touchpad - Business Standard,Google working on smart tattoos that turn skin into living touchpad  Business Standard,"Mon, 27 Jul 2020 07:00:00 GMT",https://news.google.com/rss/articles/CBMijAFodHRwczovL3d3dy5idXNpbmVzcy1zdGFuZGFyZC5jb20vYXJ0aWNsZS90ZWNobm9sb2d5L2dvb2dsZS13b3JraW5nLW9uLXNtYXJ0LXRhdHRvb3MtdGhhdC10dXJuLXNraW4taW50by1saXZpbmctdG91Y2hwYWQtMTIwMDcyNzAwMTg4XzEuaHRtbNIBkAFodHRwczovL3d3dy5idXNpbmVzcy1zdGFuZGFyZC5jb20vYW1wL2FydGljbGUvdGVjaG5vbG9neS9nb29nbGUtd29ya2luZy1vbi1zbWFydC10YXR0b29zLXRoYXQtdHVybi1za2luLWludG8tbGl2aW5nLXRvdWNocGFkLTEyMDA3MjcwMDE4OF8xLmh0bWw?oc=5&hl=en-US&gl=US&ceid=US:en,"{'href': 'https://www.business-standard.com', 'title': 'Business Standard'}",2020-07-27
Google Pixel 4a release date 'confirmed' by leaker - TechRadar,Google Pixel 4a release date 'confirmed' by leaker  TechRadar,"Mon, 27 Jul 2020 07:00:00 GMT",https://news.google.com/rss/articles/CBMiT2h0dHBzOi8vd3d3LnRlY2hyYWRhci5jb20vbmV3cy9nb29nbGUtcGl4ZWwtNGEtcmVsZWFzZS1kYXRlLWNvbmZpcm1lZC1ieS1sZWFrZXLSAQA?oc=5&hl=en-US&gl=US&ceid=US:en,"{'href': 'https://www.techradar.com', 'title': 'TechRadar'}",2020-07-27
How Google is spending its $1 billion housing commitment - Fast Company,How Google is spending its $1 billion housing commitment  Fast Company,"Mon, 27 Jul 2020 07:00:00 GMT",https://news.google.com/rss/articles/CBMiemh0dHBzOi8vd3d3LmZhc3Rjb21wYW55LmNvbS85MDUzMTc5OC90aGUtdGVjaC1pbmR1c3RyeS1leGFjZXJiYXRlZC10aGUtaG91c2luZy1jcmlzaXMtaGVyZXMtd2hhdC1nb29nbGUtaXMtZG9pbmctdG8tZml4LWl00gEA?oc=5&hl=en-US&gl=US&ceid=US:en,"{'href': 'https://www.fastcompany.com', 'title': 'Fast Company'}",2020-07-27
Google is the first major company to formally extend work-from-home until summer 2021—who's next? - CNBC,Google is the first major company to formally extend work-from-home until summer 2021—who's next?  CNBC,"Mon, 27 Jul 2020 07:00:00 GMT",https://news.google.com/rss/articles/CBMiamh0dHBzOi8vd3d3LmNuYmMuY29tLzIwMjAvMDcvMjcvZ29vZ2xlLWlzLWZpcnN0LW1ham9yLWNvbXBhbnktdG8tZXh0ZW5kLXdvcmstZnJvbS1ob21lLXRvLXN1bW1lci0yMDIxLmh0bWzSAW5odHRwczovL3d3dy5jbmJjLmNvbS9hbXAvMjAyMC8wNy8yNy9nb29nbGUtaXMtZmlyc3QtbWFqb3ItY29tcGFueS10by1leHRlbmQtd29yay1mcm9tLWhvbWUtdG8tc3VtbWVyLTIwMjEuaHRtbA?oc=5&hl=en-US&gl=US&ceid=US:en,"{'href': 'https://www.cnbc.com', 'title': 'CNBC'}",2020-07-27
Google will let employees work from home until at least next summer - CNN,Google will let employees work from home until at least next summer  CNN,"Mon, 27 Jul 2020 07:00:00 GMT",https://news.google.com/rss/articles/CBMiTmh0dHBzOi8vd3d3LmNubi5jb20vMjAyMC8wNy8yNy90ZWNoL2dvb2dsZS13b3JrLWZyb20taG9tZS1leHRlbnNpb24vaW5kZXguaHRtbNIBUmh0dHBzOi8vYW1wLmNubi5jb20vY25uLzIwMjAvMDcvMjcvdGVjaC9nb29nbGUtd29yay1mcm9tLWhvbWUtZXh0ZW5zaW9uL2luZGV4Lmh0bWw?oc=5&hl=en-US&gl=US&ceid=US:en,"{'href': 'https://www.cnn.com', 'title': 'CNN'}",2020-07-27
"Facebook, Google, Apple and Amazon's combined market cap vs ... - Axios","Facebook, Google, Apple and Amazon's combined market cap vs ...  Axios","Mon, 27 Jul 2020 07:00:00 GMT",https://news.google.com/rss/articles/CBMiPWh0dHBzOi8vd3d3LmF4aW9zLmNvbS8yMDIwLzA3LzI3L2JpZy10ZWNocy1wb3dlci1pbi00LW51bWJlcnPSAQA?oc=5&hl=en-US&gl=US&ceid=US:en,"{'href': 'https://www.axios.com', 'title': 'Axios'}",2020-07-27
"Google Drops Some Commissions, Launches Recommendation ... - Multichannel Merchant","Google Drops Some Commissions, Launches Recommendation ...  Multichannel Merchant","Mon, 27 Jul 2020 07:00:00 GMT",https://news.google.com/rss/articles/CBMiaGh0dHBzOi8vbXVsdGljaGFubmVsbWVyY2hhbnQuY29tL2Vjb21tZXJjZS9nb29nbGUtZHJvcHMtc29tZS1jb21taXNzaW9ucy1sYXVuY2hlcy1yZWNvbW1lbmRhdGlvbi1lbmdpbmUv0gEA?oc=5&hl=en-US&gl=US&ceid=US:en,"{'href': 'https://multichannelmerchant.com', 'title': 'Multichannel Merchant'}",2020-07-27
"Epic Games CEO slams Apple App Store, Google Play Store policies - ETTelecom","Epic Games CEO slams Apple App Store, Google Play Store policies  ETTelecom","Mon, 27 Jul 2020 07:00:00 GMT",https://news.google.com/rss/articles/CBMiemh0dHBzOi8vdGVsZWNvbS5lY29ub21pY3RpbWVzLmluZGlhdGltZXMuY29tL25ld3MvZXBpYy1nYW1lcy1jZW8tc2xhbXMtYXBwbGUtYXBwLXN0b3JlLWdvb2dsZS1wbGF5LXN0b3JlLXBvbGljaWVzLzc3MTk4MTc00gF-aHR0cHM6Ly90ZWxlY29tLmVjb25vbWljdGltZXMuaW5kaWF0aW1lcy5jb20vYW1wL25ld3MvZXBpYy1nYW1lcy1jZW8tc2xhbXMtYXBwbGUtYXBwLXN0b3JlLWdvb2dsZS1wbGF5LXN0b3JlLXBvbGljaWVzLzc3MTk4MTc0?oc=5&hl=en-US&gl=US&ceid=US:en,"{'href': 'https://telecom.economictimes.indiatimes.com', 'title': 'ETTelecom'}",2020-07-27
How to enable dark mode on Google App: Step-by-step guide - India Today,How to enable dark mode on Google App: Step-by-step guide  India Today,"Mon, 27 Jul 2020 07:00:00 GMT",https://news.google.com/rss/articles/CBMiZGh0dHBzOi8vd3d3LmluZGlhdG9kYXkuaW4vaW5mb3JtYXRpb24vc3RvcnkvaG93LXRvLWVuYWJsZS1kYXJrLW1vZGUtb24tZ29vZ2xlLWFwcC0xNzA0OTczLTIwMjAtMDctMjfSAWhodHRwczovL3d3dy5pbmRpYXRvZGF5LmluL2FtcC9pbmZvcm1hdGlvbi9zdG9yeS9ob3ctdG8tZW5hYmxlLWRhcmstbW9kZS1vbi1nb29nbGUtYXBwLTE3MDQ5NzMtMjAyMC0wNy0yNw?oc=5&hl=en-US&gl=US&ceid=US:en,"{'href': 'https://www.indiatoday.in', 'title': 'India Today'}",2020-07-27
Google tweaks Chrome's lazy-loading images to help save more data - Android Police,Google tweaks Chrome's lazy-loading images to help save more data  Android Police,"Mon, 27 Jul 2020 07:00:00 GMT",https://news.google.com/rss/articles/CBMiamh0dHBzOi8vd3d3LmFuZHJvaWRwb2xpY2UuY29tLzIwMjAvMDcvMjcvZ29vZ2xlLXR3ZWFrcy1jaHJvbWVzLWxhenktbG9hZGluZy1pbWFnZXMtdG8taGVscC1zYXZlLW1vcmUtZGF0YS_SAQA?oc=5&hl=en-US&gl=US&ceid=US:en,"{'href': 'https://www.androidpolice.com', 'title': 'Android Police'}",2020-07-27
Why Google Search Console Reports 5XX Server Errors - Search Engine Journal,Why Google Search Console Reports 5XX Server Errors  Search Engine Journal,"Mon, 27 Jul 2020 07:00:00 GMT",https://news.google.com/rss/articles/CBMiSGh0dHBzOi8vd3d3LnNlYXJjaGVuZ2luZWpvdXJuYWwuY29tL2dzYy1yZXBvcnRzLXNldmVyLTUwMC1lcnJvcnMvMzc1NzkxL9IBAA?oc=5&hl=en-US&gl=US&ceid=US:en,"{'href': 'https://www.searchenginejournal.com', 'title': 'Search Engine Journal'}",2020-07-27
Google victory in German top court - DW (English),Google victory in German top court  DW (English),"Mon, 27 Jul 2020 07:00:00 GMT",https://news.google.com/rss/articles/CBMiPWh0dHBzOi8vd3d3LmR3LmNvbS9lbi9nb29nbGUtcmlnaHQtdG8tYmUtZm9yZ290dGVuL2EtNTQzMjY4NzfSAT1odHRwczovL2FtcC5kdy5jb20vZW4vZ29vZ2xlLXJpZ2h0LXRvLWJlLWZvcmdvdHRlbi9hLTU0MzI2ODc3?oc=5&hl=en-US&gl=US&ceid=US:en,"{'href': 'https://www.dw.com', 'title': 'DW (English)'}",2020-07-27
Brad Zager on FOX Sports' Google Cloud Partnership: “Google ... - Sports Video Group,Brad Zager on FOX Sports' Google Cloud Partnership: “Google ...  Sports Video Group,"Mon, 27 Jul 2020 07:00:00 GMT",https://news.google.com/rss/articles/CBMiigFodHRwczovL3d3dy5zcG9ydHN2aWRlby5vcmcvMjAyMC8wNy8yNy9icmFkLXphZ2VyLW9uLWZveC1zcG9ydHMtZ29vZ2xlLWNsb3VkLXBhcnRuZXJzaGlwLWdvb2dsZS1hcHByb2FjaGVzLWV2ZXJ5dGhpbmctaW4tYS11c2VyLWZpcnN0LXdheS_SAQA?oc=5&hl=en-US&gl=US&ceid=US:en,"{'href': 'https://www.sportsvideo.org', 'title': 'Sports Video Group'}",2020-07-27
Gboard Rolling out Image Pasting in Clipboard and Google Lens Integration on Android - Beebom,Gboard Rolling out Image Pasting in Clipboard and Google Lens Integration on Android  Beebom,"Mon, 27 Jul 2020 07:00:00 GMT",https://news.google.com/rss/articles/CBMiNmh0dHBzOi8vYmVlYm9tLmNvbS9nYm9hcmQtaW1hZ2UtY2xpcGJvYXJkLWdvb2dsZS1sZW5zL9IBOmh0dHBzOi8vYmVlYm9tLmNvbS9nYm9hcmQtaW1hZ2UtY2xpcGJvYXJkLWdvb2dsZS1sZW5zL2FtcC8?oc=5&hl=en-US&gl=US&ceid=US:en,"{'href': 'https://beebom.com', 'title': 'Beebom'}",2020-07-27
How to Add Your Google Calendar to Apple's Calendar App (and ... - Lifehacker,How to Add Your Google Calendar to Apple's Calendar App (and ...  Lifehacker,"Mon, 27 Jul 2020 07:00:00 GMT",https://news.google.com/rss/articles/CBMiWGh0dHBzOi8vbGlmZWhhY2tlci5jb20vaG93LXRvLWFkZC15b3VyLWdvb2dsZS1jYWxlbmRhci10by1hcHBsZXMtY2FsZW5kYXItYXBwLTE4NDQ0OTg2MzjSAQA?oc=5&hl=en-US&gl=US&ceid=US:en,"{'href': 'https://lifehacker.com', 'title': 'Lifehacker'}",2020-07-27
Google is bringing in the 'Back Forward Cache' for Chrome 86 in ... - Digital Information World,Google is bringing in the 'Back Forward Cache' for Chrome 86 in ...  Digital Information World,"Tue, 28 Jul 2020 07:00:00 GMT",https://news.google.com/rss/articles/CBMiemh0dHBzOi8vd3d3LmRpZ2l0YWxpbmZvcm1hdGlvbndvcmxkLmNvbS8yMDIwLzA3L2dvb2dsZS1pcy1icmluZ2luZy1pbi10aGUtYmFjay1mb3J3YXJkLWNhY2hlLWZvci1jaHJvbWUtODYtaW4tYW5kcm9pZC5odG1s0gEA?oc=5&hl=en-US&gl=US&ceid=US:en,"{'href': 'https://www.digitalinformationworld.com', 'title': 'Digital Information World'}",2020-07-27
Google is replacing Nest thermostats affected by Wi-Fi connectivity ... - Android Central,Google is replacing Nest thermostats affected by Wi-Fi connectivity ...  Android Central,"Mon, 27 Jul 2020 07:00:00 GMT",https://news.google.com/rss/articles/CBMiY2h0dHBzOi8vd3d3LmFuZHJvaWRjZW50cmFsLmNvbS9nb29nbGUtcmVwbGFjaW5nLW5lc3QtdGhlcm1vc3RhdHMtYWZmZWN0ZWQtd2ktZmktY29ubmVjdGl2aXR5LWlzc3Vlc9IBAA?oc=5&hl=en-US&gl=US&ceid=US:en,"{'href': 'https://www.androidcentral.com', 'title': 'Android Central'}",2020-07-27
Understanding 'Explanations' in Google Ads - Practical Ecommerce,Understanding 'Explanations' in Google Ads  Practical Ecommerce,"Sun, 26 Jul 2020 07:00:00 GMT",https://news.google.com/rss/articles/CBMiS2h0dHBzOi8vd3d3LnByYWN0aWNhbGVjb21tZXJjZS5jb20vdW5kZXJzdGFuZGluZy1leHBsYW5hdGlvbnMtaW4tZ29vZ2xlLWFkc9IBAA?oc=5&hl=en-US&gl=US&ceid=US:en,"{'href': 'https://www.practicalecommerce.com', 'title': 'Practical Ecommerce'}",2020-07-26
Google Maps Bike Directions Update | Google Maps Bikeshare Info - Bicycling,Google Maps Bike Directions Update | Google Maps Bikeshare Info  Bicycling,"Sun, 26 Jul 2020 07:00:00 GMT",https://news.google.com/rss/articles/CBMiWGh0dHBzOi8vd3d3LmJpY3ljbGluZy5jb20vbmV3cy9hMzM0MTY4MzQvZ29vZ2xlLW1hcHMtZGlyZWN0aW9ucy1iZXR3ZWVuLWJpa2VzaGFyZS1kb2Nrcy_SAQA?oc=5&hl=en-US&gl=US&ceid=US:en,"{'href': 'https://www.bicycling.com', 'title': 'Bicycling'}",2020-07-26
"Google, Facebook seek publisher deals ahead of ACCC ruling - Sydney Morning Herald","Google, Facebook seek publisher deals ahead of ACCC ruling  Sydney Morning Herald","Mon, 27 Jul 2020 07:00:00 GMT",https://news.google.com/rss/articles/CBMieGh0dHBzOi8vd3d3LnNtaC5jb20uYXUvYnVzaW5lc3MvY29tcGFuaWVzL2dvb2dsZS1mYWNlYm9vay1zZWVrLXB1Ymxpc2hlci1kZWFscy1haGVhZC1vZi1hY2NjLXJ1bGluZy0yMDIwMDcyNC1wNTVmaXIuaHRtbNIBeGh0dHBzOi8vYW1wLnNtaC5jb20uYXUvYnVzaW5lc3MvY29tcGFuaWVzL2dvb2dsZS1mYWNlYm9vay1zZWVrLXB1Ymxpc2hlci1kZWFscy1haGVhZC1vZi1hY2NjLXJ1bGluZy0yMDIwMDcyNC1wNTVmaXIuaHRtbA?oc=5&hl=en-US&gl=US&ceid=US:en,"{'href': 'https://www.smh.com.au', 'title': 'Sydney Morning Herald'}",2020-07-26
Tipster 100% confident Google Pixel 4a will launch on August 3 - PhoneArena,Tipster 100% confident Google Pixel 4a will launch on August 3  PhoneArena,"Sun, 26 Jul 2020 07:00:00 GMT",https://news.google.com/rss/articles/CBMiRGh0dHBzOi8vd3d3LnBob25lYXJlbmEuY29tL25ld3MvR29vZ2xlLVBpeGVsLTRhLWxhdW5jaC1kYXRlX2lkMTI2MTg20gEA?oc=5&hl=en-US&gl=US&ceid=US:en,"{'href': 'https://www.phonearena.com', 'title': 'PhoneArena'}",2020-07-26
Google Duo now lets users apply filters before starting a video call - MobileSyrup,Google Duo now lets users apply filters before starting a video call  MobileSyrup,"Sun, 26 Jul 2020 07:00:00 GMT",https://news.google.com/rss/articles/CBMiYmh0dHBzOi8vbW9iaWxlc3lydXAuY29tLzIwMjAvMDcvMjYvZ29vZ2xlLWR1by1sZXRzLXVzZXJzLWFwcGx5LWZpbHRlcnMtYmVmb3JlLXN0YXJ0aW5nLXZpZGVvLWNhbGwv0gEA?oc=5&hl=en-US&gl=US&ceid=US:en,"{'href': 'https://mobilesyrup.com', 'title': 'MobileSyrup'}",2020-07-26
Candid.Technology How to update Google Play Store? - Candid.Technology,Candid.Technology How to update Google Play Store?  Candid.Technology,"Sun, 26 Jul 2020 07:00:00 GMT",https://news.google.com/rss/articles/CBMiM2h0dHBzOi8vY2FuZGlkLnRlY2hub2xvZ3kvdXBkYXRlLWdvb2dsZS1wbGF5LXN0b3JlL9IBAA?oc=5&hl=en-US&gl=US&ceid=US:en,"{'href': 'https://candid.technology', 'title': 'Candid.Technology'}",2020-07-26
23 Power Players Driving Google's Most Valuable Products Right Now - Business Insider,23 Power Players Driving Google's Most Valuable Products Right Now  Business Insider,"Mon, 27 Jul 2020 07:00:00 GMT",https://news.google.com/rss/articles/CBMiZWh0dHBzOi8vd3d3LmJ1c2luZXNzaW5zaWRlci5jb20vcG93ZXItcGxheWVycy1kcml2aW5nLWdvb2dsZXMtbW9zdC12YWx1YWJsZS1wcm9kdWN0cy1yaWdodC1ub3ctMjAyMC030gEA?oc=5&hl=en-US&gl=US&ceid=US:en,"{'href': 'https://www.businessinsider.com', 'title': 'Business Insider'}",2020-07-26
Google Chrome now supports lazy loading iframes for speeding up ... - XDA Developers,Google Chrome now supports lazy loading iframes for speeding up ...  XDA Developers,"Mon, 27 Jul 2020 07:00:00 GMT",https://news.google.com/rss/articles/CBMiZmh0dHBzOi8vd3d3LnhkYS1kZXZlbG9wZXJzLmNvbS9nb29nbGUtY2hyb21lLW5vdy1zdXBwb3J0cy1sYXp5LWxvYWRpbmctaWZyYW1lcy1zcGVlZGluZy11cC1wYWdlLWxvYWRzL9IBAA?oc=5&hl=en-US&gl=US&ceid=US:en,"{'href': 'https://www.xda-developers.com', 'title': 'XDA Developers'}",2020-07-26
Google Luncurkan Fitur Penerjemah Bahasa Mesir Kuno - detikTravel,Google Luncurkan Fitur Penerjemah Bahasa Mesir Kuno  detikTravel,"Sun, 26 Jul 2020 07:00:00 GMT",https://news.google.com/rss/articles/CBMiYmh0dHBzOi8vdHJhdmVsLmRldGlrLmNvbS90cmF2ZWwtbmV3cy9kLTUxMDg3MTYvZ29vZ2xlLWx1bmN1cmthbi1maXR1ci1wZW5lcmplbWFoLWJhaGFzYS1tZXNpci1rdW5v0gEA?oc=5&hl=en-US&gl=US&ceid=US:en,"{'href': 'https://travel.detik.com', 'title': 'detikTravel'}",2020-07-26
Google Lens is now integrated into Gboard which brings a cool function - Gizchina.com,Google Lens is now integrated into Gboard which brings a cool function  Gizchina.com,"Sat, 25 Jul 2020 07:00:00 GMT",https://news.google.com/rss/articles/CBMia2h0dHBzOi8vd3d3LmdpemNoaW5hLmNvbS8yMDIwLzA3LzI1L2dvb2dsZS1sZW5zLWlzLW5vdy1pbnRlZ3JhdGVkLWludG8tZ2JvYXJkLXdoaWNoLWJyaW5ncy1hLWNvb2wtZnVuY3Rpb24v0gFvaHR0cHM6Ly93d3cuZ2l6Y2hpbmEuY29tLzIwMjAvMDcvMjUvZ29vZ2xlLWxlbnMtaXMtbm93LWludGVncmF0ZWQtaW50by1nYm9hcmQtd2hpY2gtYnJpbmdzLWEtY29vbC1mdW5jdGlvbi9hbXAv?oc=5&hl=en-US&gl=US&ceid=US:en,"{'href': 'https://www.gizchina.com', 'title': 'Gizchina.com'}",2020-07-25
Google is reportedly collecting data from rival apps to improve its own products - HT Tech,Google is reportedly collecting data from rival apps to improve its own products  HT Tech,"Sat, 25 Jul 2020 07:00:00 GMT",https://news.google.com/rss/articles/CBMijgFodHRwczovL3RlY2guaGluZHVzdGFudGltZXMuY29tL3RlY2gvbmV3cy9nb29nbGUtaXMtcmVwb3J0ZWRseS1jb2xsZWN0aW5nLWRhdGEtZnJvbS1yaXZhbC1hcHBzLXRvLWltcHJvdmUtaXRzLW93bi1wcm9kdWN0cy03MTU5NTY3NDA2NzU0My5odG1s0gGSAWh0dHBzOi8vdGVjaC5oaW5kdXN0YW50aW1lcy5jb20vYW1wL3RlY2gvbmV3cy9nb29nbGUtaXMtcmVwb3J0ZWRseS1jb2xsZWN0aW5nLWRhdGEtZnJvbS1yaXZhbC1hcHBzLXRvLWltcHJvdmUtaXRzLW93bi1wcm9kdWN0cy03MTU5NTY3NDA2NzU0My5odG1s?oc=5&hl=en-US&gl=US&ceid=US:en,"{'href': 'https://tech.hindustantimes.com', 'title': 'HT Tech'}",2020-07-25
Google will replace Nest thermostats affected by 'w5' WiFi error - Engadget,Google will replace Nest thermostats affected by 'w5' WiFi error  Engadget,"Sat, 25 Jul 2020 07:00:00 GMT",https://news.google.com/rss/articles/CBMiSWh0dHBzOi8vd3d3LmVuZ2FkZ2V0LmNvbS9nb29nbGUtcmVwbGFjZS1uZXN0LXc1LXdpZmktZXJyb3ItMDcwMTMxODIwLmh0bWzSAU1odHRwczovL3d3dy5lbmdhZGdldC5jb20vYW1wL2dvb2dsZS1yZXBsYWNlLW5lc3QtdzUtd2lmaS1lcnJvci0wNzAxMzE4MjAuaHRtbA?oc=5&hl=en-US&gl=US&ceid=US:en,"{'href': 'https://www.engadget.com', 'title': 'Engadget'}",2020-07-25
Elon Musk: The Maureen Dowd Interview - The New York Times,Elon Musk: The Maureen Dowd Interview  The New York Times,"Sun, 26 Jul 2020 07:00:00 GMT",https://news.google.com/rss/articles/CBMiRGh0dHBzOi8vd3d3Lm55dGltZXMuY29tLzIwMjAvMDcvMjUvc3R5bGUvZWxvbi1tdXNrLW1hdXJlZW4tZG93ZC5odG1s0gEA?oc=5&hl=en-US&gl=US&ceid=US:en,"{'href': 'https://www.nytimes.com', 'title': 'The New York Times'}",2020-07-25
Google's John Mueller Discusses Recent Changes to Search - Search Engine Journal,Google's John Mueller Discusses Recent Changes to Search  Search Engine Journal,"Fri, 24 Jul 2020 07:00:00 GMT",https://news.google.com/rss/articles/CBMiXGh0dHBzOi8vd3d3LnNlYXJjaGVuZ2luZWpvdXJuYWwuY29tL2dvb2dsZXMtam9obi1tdWVsbGVyLWRpc2N1c3Nlcy1jaGFuZ2VzLXRvLXNlYXJjaC8zNzU1NTIv0gEA?oc=5&hl=en-US&gl=US&ceid=US:en,"{'href': 'https://www.searchenginejournal.com', 'title': 'Search Engine Journal'}",2020-07-24
Google reportedly keeps tabs on usage of rival Android apps to ... - The Verge,Google reportedly keeps tabs on usage of rival Android apps to ...  The Verge,"Fri, 24 Jul 2020 07:00:00 GMT",https://news.google.com/rss/articles/CBMiZWh0dHBzOi8vd3d3LnRoZXZlcmdlLmNvbS8yMDIwLzcvMjQvMjEzMzY5NDYvZ29vZ2xlLWFuZHJvaWQtbG9ja2JveC1kYXRhLXJpdmFsLWFwcHMtYW50aXRydXN0LXNjcnV0aW550gEA?oc=5&hl=en-US&gl=US&ceid=US:en,"{'href': 'https://www.theverge.com', 'title': 'The Verge'}",2020-07-24
Google reportedly peeks into Android data to gain edge over third-party apps - Ars Technica,Google reportedly peeks into Android data to gain edge over third-party apps  Ars Technica,"Fri, 24 Jul 2020 07:00:00 GMT",https://news.google.com/rss/articles/CBMicmh0dHBzOi8vYXJzdGVjaG5pY2EuY29tL3RlY2gtcG9saWN5LzIwMjAvMDcvYW5kcm9pZC11c2VyLWRhdGEtZ2l2ZXMtZ29vZ2xlLWVkZ2Utb3Zlci10aGlyZC1wYXJ0eS1hcHBzLXJlcG9ydC1zYXlzL9IBdmh0dHBzOi8vYXJzdGVjaG5pY2EuY29tL3RlY2gtcG9saWN5LzIwMjAvMDcvYW5kcm9pZC11c2VyLWRhdGEtZ2l2ZXMtZ29vZ2xlLWVkZ2Utb3Zlci10aGlyZC1wYXJ0eS1hcHBzLXJlcG9ydC1zYXlzL2FtcC8?oc=5&hl=en-US&gl=US&ceid=US:en,"{'href': 'https://arstechnica.com', 'title': 'Ars Technica'}",2020-07-24
Google reportedly scraped data on competitors' apps running on Android - Business Insider,Google reportedly scraped data on competitors' apps running on Android  Business Insider,"Fri, 24 Jul 2020 07:00:00 GMT",https://news.google.com/rss/articles/CBMibGh0dHBzOi8vd3d3LmJ1c2luZXNzaW5zaWRlci5jb20vZ29vZ2xlLXJlcG9ydGVkbHktc2NyYXBlZC1kYXRhLW9uLWNvbXBldGl0b3JzLWFwcHMtcnVubmluZy1vbi1hbmRyb2lkLTIwMjAtN9IBcGh0dHBzOi8vd3d3LmJ1c2luZXNzaW5zaWRlci5jb20vZ29vZ2xlLXJlcG9ydGVkbHktc2NyYXBlZC1kYXRhLW9uLWNvbXBldGl0b3JzLWFwcHMtcnVubmluZy1vbi1hbmRyb2lkLTIwMjAtNz9hbXA?oc=5&hl=en-US&gl=US&ceid=US:en,"{'href': 'https://www.businessinsider.com', 'title': 'Business Insider'}",2020-07-24
"Some Nest thermostats can no longer connect to the internet, so ... - The Verge","Some Nest thermostats can no longer connect to the internet, so ...  The Verge","Fri, 24 Jul 2020 07:00:00 GMT",https://news.google.com/rss/articles/CBMic2h0dHBzOi8vd3d3LnRoZXZlcmdlLmNvbS8yMDIwLzcvMjQvMjEzMzc2NjkvZ29vZ2xlLW5lc3QtdGhlcm1vc3RhdC13NS13aWZpLWlzc3VlLXJlbW90ZS1jb250cm9sLWRpc2FibGUtcmVwbGFjZW1lbnTSAQA?oc=5&hl=en-US&gl=US&ceid=US:en,"{'href': 'https://www.theverge.com', 'title': 'The Verge'}",2020-07-24
"Apple, Microsoft, Amazon, Google And Facebook Make Up A Record Chunk Of The S&P 500. Here’s Why That Might Be Dangerous - Forbes","Apple, Microsoft, Amazon, Google And Facebook Make Up A Record Chunk Of The S&P 500. Here’s Why That Might Be Dangerous  Forbes","Fri, 24 Jul 2020 07:00:00 GMT",https://news.google.com/rss/articles/CBMiqgFodHRwczovL3d3dy5mb3JiZXMuY29tL3NpdGVzL3NlcmdlaWtsZWJuaWtvdi8yMDIwLzA3LzI0L2FwcGxlLW1pY3Jvc29mdC1hbWF6b24tZ29vZ2xlLWFuZC1mYWNlYm9vay1tYWtlLXVwLWEtcmVjb3JkLWNodW5rLW9mLXRoZS1zcC01MDAtaGVyZXMtd2h5LXRoYXQtbWlnaHQtYmUtZGFuZ2Vyb3VzL9IBrgFodHRwczovL3d3dy5mb3JiZXMuY29tL3NpdGVzL3NlcmdlaWtsZWJuaWtvdi8yMDIwLzA3LzI0L2FwcGxlLW1pY3Jvc29mdC1hbWF6b24tZ29vZ2xlLWFuZC1mYWNlYm9vay1tYWtlLXVwLWEtcmVjb3JkLWNodW5rLW9mLXRoZS1zcC01MDAtaGVyZXMtd2h5LXRoYXQtbWlnaHQtYmUtZGFuZ2Vyb3VzL2FtcC8?oc=5&hl=en-US&gl=US&ceid=US:en,"{'href': 'https://www.forbes.com', 'title': 'Forbes'}",2020-07-24
Chinese-made drone app in Google Play spooks security researchers - Ars Technica,Chinese-made drone app in Google Play spooks security researchers  Ars Technica,"Fri, 24 Jul 2020 07:00:00 GMT",https://news.google.com/rss/articles/CBMieWh0dHBzOi8vYXJzdGVjaG5pY2EuY29tL2luZm9ybWF0aW9uLXRlY2hub2xvZ3kvMjAyMC8wNy9jaGluZXNlLW1hZGUtZHJvbmUtYXBwLWluLWdvb2dsZS1wbGF5LXNwb29rcy1zZWN1cml0eS1yZXNlYXJjaGVycy_SAX1odHRwczovL2Fyc3RlY2huaWNhLmNvbS9pbmZvcm1hdGlvbi10ZWNobm9sb2d5LzIwMjAvMDcvY2hpbmVzZS1tYWRlLWRyb25lLWFwcC1pbi1nb29nbGUtcGxheS1zcG9va3Mtc2VjdXJpdHktcmVzZWFyY2hlcnMvYW1wLw?oc=5&hl=en-US&gl=US&ceid=US:en,"{'href': 'https://arstechnica.com', 'title': 'Ars Technica'}",2020-07-24
Android 11 is codenamed Red Velvet Cake — but Google won't call ... - TNW,Android 11 is codenamed Red Velvet Cake — but Google won't call ...  TNW,"Fri, 24 Jul 2020 07:00:00 GMT",https://news.google.com/rss/articles/CBMiYGh0dHBzOi8vdGhlbmV4dHdlYi5jb20vbmV3cy9hbmRyb2lkLTExLWlzLWNvZGVuYW1lZC1yZWQtdmVsdmV0LWNha2UtYnV0LWdvb2dsZS13b250LWNhbGwtaXQtdGhhdNIBAA?oc=5&hl=en-US&gl=US&ceid=US:en,"{'href': 'https://thenextweb.com', 'title': 'TNW'}",2020-07-24
Google Pixel 4a Geekbench listing implies all hope is not lost - PhoneArena,Google Pixel 4a Geekbench listing implies all hope is not lost  PhoneArena,"Fri, 24 Jul 2020 07:00:00 GMT",https://news.google.com/rss/articles/CBMiSmh0dHBzOi8vd3d3LnBob25lYXJlbmEuY29tL25ld3MvR29vZ2xlLVBpeGVsLTRhLUdlZWtiZW5jaC1saXN0aW5nX2lkMTI2MTYy0gEA?oc=5&hl=en-US&gl=US&ceid=US:en,"{'href': 'https://www.phonearena.com', 'title': 'PhoneArena'}",2020-07-24
Google Assistant is Getting a New ‘Family Bell’ Feature Soon - Beebom,Google Assistant is Getting a New ‘Family Bell’ Feature Soon  Beebom,"Fri, 24 Jul 2020 07:00:00 GMT",https://news.google.com/rss/articles/CBMiOGh0dHBzOi8vYmVlYm9tLmNvbS9nb29nbGUtYXNzaXN0YW50LWZhbWlseS1iZWxsLWZlYXR1cmUv0gE8aHR0cHM6Ly9iZWVib20uY29tL2dvb2dsZS1hc3Npc3RhbnQtZmFtaWx5LWJlbGwtZmVhdHVyZS9hbXAv?oc=5&hl=en-US&gl=US&ceid=US:en,"{'href': 'https://beebom.com', 'title': 'Beebom'}",2020-07-24
Google Involved in Yet Another Illegal App Tracking Privacy Lawsuit - CPO Magazine,Google Involved in Yet Another Illegal App Tracking Privacy Lawsuit  CPO Magazine,"Fri, 24 Jul 2020 07:00:00 GMT",https://news.google.com/rss/articles/CBMibWh0dHBzOi8vd3d3LmNwb21hZ2F6aW5lLmNvbS9kYXRhLXByaXZhY3kvZ29vZ2xlLWludm9sdmVkLWluLXlldC1hbm90aGVyLWlsbGVnYWwtYXBwLXRyYWNraW5nLXByaXZhY3ktbGF3c3VpdC_SAQA?oc=5&hl=en-US&gl=US&ceid=US:en,"{'href': 'https://www.cpomagazine.com', 'title': 'CPO Magazine'}",2020-07-24
How to recharge FASTag using Google Pay: Step-by-step guide - India Today,How to recharge FASTag using Google Pay: Step-by-step guide  India Today,"Fri, 24 Jul 2020 07:00:00 GMT",https://news.google.com/rss/articles/CBMieWh0dHBzOi8vd3d3LmluZGlhdG9kYXkuaW4vaW5mb3JtYXRpb24vc3RvcnkvaG93LXRvLXJlY2hhcmdlLWZhc3RhZy11c2luZy1nb29nbGUtcGF5LXN0ZXAtYnktc3RlcC1ndWlkZS0xNzA0MTAwLTIwMjAtMDctMjTSAX1odHRwczovL3d3dy5pbmRpYXRvZGF5LmluL2FtcC9pbmZvcm1hdGlvbi9zdG9yeS9ob3ctdG8tcmVjaGFyZ2UtZmFzdGFnLXVzaW5nLWdvb2dsZS1wYXktc3RlcC1ieS1zdGVwLWd1aWRlLTE3MDQxMDAtMjAyMC0wNy0yNA?oc=5&hl=en-US&gl=US&ceid=US:en,"{'href': 'https://www.indiatoday.in', 'title': 'India Today'}",2020-07-24
Deep Google Lens Integration Is Now Available To You In Gboard - Android Headlines,Deep Google Lens Integration Is Now Available To You In Gboard  Android Headlines,"Fri, 24 Jul 2020 07:00:00 GMT",https://news.google.com/rss/articles/CBMiVmh0dHBzOi8vd3d3LmFuZHJvaWRoZWFkbGluZXMuY29tLzIwMjAvMDcvZGVlcC1nb29nbGUtbGVucy1pbnRlZ3JhdGlvbi1nYm9hcmQtYmV0YS5odG1s0gFaaHR0cHM6Ly93d3cuYW5kcm9pZGhlYWRsaW5lcy5jb20vMjAyMC8wNy9kZWVwLWdvb2dsZS1sZW5zLWludGVncmF0aW9uLWdib2FyZC1iZXRhLmh0bWw_YW1w?oc=5&hl=en-US&gl=US&ceid=US:en,"{'href': 'https://www.androidheadlines.com', 'title': 'Android Headlines'}",2020-07-24
Microsoft fixes annoying bug in Google Chrome and Edge - WindowsLatest,Microsoft fixes annoying bug in Google Chrome and Edge  WindowsLatest,"Fri, 24 Jul 2020 07:00:00 GMT",https://news.google.com/rss/articles/CBMiZGh0dHBzOi8vd3d3LndpbmRvd3NsYXRlc3QuY29tLzIwMjAvMDcvMjQvbWljcm9zb2Z0LWZpeGVzLWRyYWctYW5kLWRyb3AtYmVoYXZpb3VyLWluLWNocm9tZS1hbmQtZWRnZS_SAWhodHRwczovL3d3dy53aW5kb3dzbGF0ZXN0LmNvbS8yMDIwLzA3LzI0L21pY3Jvc29mdC1maXhlcy1kcmFnLWFuZC1kcm9wLWJlaGF2aW91ci1pbi1jaHJvbWUtYW5kLWVkZ2UvYW1wLw?oc=5&hl=en-US&gl=US&ceid=US:en,"{'href': 'https://www.windowslatest.com', 'title': 'WindowsLatest'}",2020-07-24
The creator of Inbox is ready to save Google from itself - Computerworld,The creator of Inbox is ready to save Google from itself  Computerworld,"Thu, 23 Jul 2020 07:00:00 GMT",https://news.google.com/rss/articles/CBMiR2h0dHBzOi8vd3d3LmNvbXB1dGVyd29ybGQuY29tL2FydGljbGUvMzU2Nzk4OC9nb29nbGUtaW5ib3gtY3JlYXRvci5odG1s0gFLaHR0cHM6Ly93d3cuY29tcHV0ZXJ3b3JsZC5jb20vYXJ0aWNsZS8zNTY3OTg4L2dvb2dsZS1pbmJveC1jcmVhdG9yLmFtcC5odG1s?oc=5&hl=en-US&gl=US&ceid=US:en,"{'href': 'https://www.computerworld.com', 'title': 'Computerworld'}",2020-07-23
