title,description,published date,url,publisher,date
How to Fix Google Drive Waiting to Upload Error - Gadgets To Use,How to Fix Google Drive Waiting to Upload Error  Gadgets To Use,"Wed, 26 Aug 2020 07:00:00 GMT",https://news.google.com/rss/articles/CBMiWWh0dHBzOi8vZ2FkZ2V0c3RvdXNlLmNvbS9ibG9nLzIwMjAvMDgvMjYvaG93LXRvLWZpeC1nb29nbGUtZHJpdmUtd2FpdGluZy10by11cGxvYWQtZXJyb3Iv0gEA?oc=5&hl=en-US&gl=US&ceid=US:en,"{'href': 'https://gadgetstouse.com', 'title': 'Gadgets To Use'}",2020-08-26
Google Cloud Platform Acquires StratoZone to Ramp Up Cloud ... - AiThority,Google Cloud Platform Acquires StratoZone to Ramp Up Cloud ...  AiThority,"Wed, 26 Aug 2020 07:00:00 GMT",https://news.google.com/rss/articles/CBMiiAFodHRwczovL2FpdGhvcml0eS5jb20vaXQtYW5kLWRldm9wcy9jbG91ZC9nb29nbGUtY2xvdWQtcGxhdGZvcm0tYWNxdWlyZXMtc3RyYXRvem9uZS10by1yYW1wLXVwLWNsb3VkLW1pZ3JhdGlvbi1kaXNjb3ZlcnktYW5kLWFzc2Vzc21lbnQv0gEA?oc=5&hl=en-US&gl=US&ceid=US:en,"{'href': 'https://aithority.com', 'title': 'AiThority'}",2020-08-26
Unredacted suit shows Google’s own engineers confused by privacy settings - Ars Technica,Unredacted suit shows Google’s own engineers confused by privacy settings  Ars Technica,"Tue, 25 Aug 2020 07:00:00 GMT",https://news.google.com/rss/articles/CBMidWh0dHBzOi8vYXJzdGVjaG5pY2EuY29tL3RlY2gtcG9saWN5LzIwMjAvMDgvdW5yZWRhY3RlZC1zdWl0LXNob3dzLWdvb2dsZXMtb3duLWVuZ2luZWVycy1jb25mdXNlZC1ieS1wcml2YWN5LXNldHRpbmdzL9IBeWh0dHBzOi8vYXJzdGVjaG5pY2EuY29tL3RlY2gtcG9saWN5LzIwMjAvMDgvdW5yZWRhY3RlZC1zdWl0LXNob3dzLWdvb2dsZXMtb3duLWVuZ2luZWVycy1jb25mdXNlZC1ieS1wcml2YWN5LXNldHRpbmdzL2FtcC8?oc=5&hl=en-US&gl=US&ceid=US:en,"{'href': 'https://arstechnica.com', 'title': 'Ars Technica'}",2020-08-25
"Verily, Google's health-focused sister company, is getting into ... - The Verge","Verily, Google's health-focused sister company, is getting into ...  The Verge","Tue, 25 Aug 2020 07:00:00 GMT",https://news.google.com/rss/articles/CBMiW2h0dHBzOi8vd3d3LnRoZXZlcmdlLmNvbS8yMDIwLzgvMjUvMjE0MDExMjQvYWxwaGFiZXQtdmVyaWx5LWluc3VyYW5jZS1jb2VmZmljaWVudC1zdG9wLWxvc3PSAQA?oc=5&hl=en-US&gl=US&ceid=US:en,"{'href': 'https://www.theverge.com', 'title': 'The Verge'}",2020-08-25
Google makes NASA artifacts and prehistoric crustaceans viewable ... - The Verge,Google makes NASA artifacts and prehistoric crustaceans viewable ...  The Verge,"Tue, 25 Aug 2020 07:00:00 GMT",https://news.google.com/rss/articles/CBMie2h0dHBzOi8vd3d3LnRoZXZlcmdlLmNvbS8yMDIwLzgvMjUvMjE0MDA1NzcvZ29vZ2xlLWFydHMtYW5kLWN1bHR1cmUtYXVnbWVudGVkLXJlYWxpdHktcHJlaGlzdG9yaWMtY3JlYXR1cmVzLW11c2V1bS1leGhpYml0c9IBAA?oc=5&hl=en-US&gl=US&ceid=US:en,"{'href': 'https://www.theverge.com', 'title': 'The Verge'}",2020-08-25
"Google AR app lets you place prehistoric creatures, Apollo 11 in your room - Ars Technica","Google AR app lets you place prehistoric creatures, Apollo 11 in your room  Ars Technica","Tue, 25 Aug 2020 07:00:00 GMT",https://news.google.com/rss/articles/CBMicmh0dHBzOi8vYXJzdGVjaG5pY2EuY29tL2dhZGdldHMvMjAyMC8wOC9nb29nbGUtYXItYXBwLWxldHMteW91LXBsYWNlLXByZWhpc3RvcmljLWNyZWF0dXJlcy1hcG9sbG8tMTEtaW4teW91ci1yb29tL9IBdmh0dHBzOi8vYXJzdGVjaG5pY2EuY29tL2dhZGdldHMvMjAyMC8wOC9nb29nbGUtYXItYXBwLWxldHMteW91LXBsYWNlLXByZWhpc3RvcmljLWNyZWF0dXJlcy1hcG9sbG8tMTEtaW4teW91ci1yb29tL2FtcC8?oc=5&hl=en-US&gl=US&ceid=US:en,"{'href': 'https://arstechnica.com', 'title': 'Ars Technica'}",2020-08-25
Panera adds online ordering through Google - Restaurant Dive,Panera adds online ordering through Google  Restaurant Dive,"Tue, 25 Aug 2020 07:00:00 GMT",https://news.google.com/rss/articles/CBMiVmh0dHBzOi8vd3d3LnJlc3RhdXJhbnRkaXZlLmNvbS9uZXdzL3BhbmVyYS1hZGRzLW9ubGluZS1vcmRlcmluZy10aHJvdWdoLWdvb2dsZS81ODQwOTEv0gEA?oc=5&hl=en-US&gl=US&ceid=US:en,"{'href': 'https://www.restaurantdive.com', 'title': 'Restaurant Dive'}",2020-08-25
Google Anthos Gains New Features Including Hybrid AI Capabilities - Forbes,Google Anthos Gains New Features Including Hybrid AI Capabilities  Forbes,"Tue, 25 Aug 2020 07:00:00 GMT",https://news.google.com/rss/articles/CBMid2h0dHBzOi8vd3d3LmZvcmJlcy5jb20vc2l0ZXMvamFuYWtpcmFtbXN2LzIwMjAvMDgvMjUvZ29vZ2xlLWFudGhvcy1nYWlucy1uZXctZmVhdHVyZXMtaW5jbHVkaW5nLWh5YnJpZC1haS1jYXBhYmlsaXRpZXMv0gF7aHR0cHM6Ly93d3cuZm9yYmVzLmNvbS9zaXRlcy9qYW5ha2lyYW1tc3YvMjAyMC8wOC8yNS9nb29nbGUtYW50aG9zLWdhaW5zLW5ldy1mZWF0dXJlcy1pbmNsdWRpbmctaHlicmlkLWFpLWNhcGFiaWxpdGllcy9hbXAv?oc=5&hl=en-US&gl=US&ceid=US:en,"{'href': 'https://www.forbes.com', 'title': 'Forbes'}",2020-08-25
Google names Halimah DeLaine Prado new general counsel as antitrust cases loom - CNBC,Google names Halimah DeLaine Prado new general counsel as antitrust cases loom  CNBC,"Tue, 25 Aug 2020 07:00:00 GMT",https://news.google.com/rss/articles/CBMia2h0dHBzOi8vd3d3LmNuYmMuY29tLzIwMjAvMDgvMjUvZ29vZ2xlLW5hbWVzLWhhbGltYWgtZGVsYWluZS1wcmFkby1hcy1jaGllZi1jb3Vuc2VsLWFzLWFudGl0cnVzdC1sb29tcy5odG1s0gFvaHR0cHM6Ly93d3cuY25iYy5jb20vYW1wLzIwMjAvMDgvMjUvZ29vZ2xlLW5hbWVzLWhhbGltYWgtZGVsYWluZS1wcmFkby1hcy1jaGllZi1jb3Vuc2VsLWFzLWFudGl0cnVzdC1sb29tcy5odG1s?oc=5&hl=en-US&gl=US&ceid=US:en,"{'href': 'https://www.cnbc.com', 'title': 'CNBC'}",2020-08-25
Google Chrome's new 'heavy ads' blocker catches some publishers ... - Digiday,Google Chrome's new 'heavy ads' blocker catches some publishers ...  Digiday,"Wed, 26 Aug 2020 07:00:00 GMT",https://news.google.com/rss/articles/CBMiY2h0dHBzOi8vZGlnaWRheS5jb20vbWVkaWEvZ29vZ2xlLWNocm9tZXMtbmV3LWhlYXZ5LWFkcy1ibG9ja2VyLWNhdGNoZXMtc29tZS1wdWJsaXNoZXJzLWJ5LXN1cnByaXNlL9IBAA?oc=5&hl=en-US&gl=US&ceid=US:en,"{'href': 'https://digiday.com', 'title': 'Digiday'}",2020-08-25
Google and Apple-supported coronavirus tracking apps land from ... - USA TODAY,Google and Apple-supported coronavirus tracking apps land from ...  USA TODAY,"Tue, 25 Aug 2020 07:00:00 GMT",https://news.google.com/rss/articles/CBMihQFodHRwczovL3d3dy51c2F0b2RheS5jb20vc3RvcnkvdGVjaC9jb2x1bW5pc3QvMjAyMC8wOC8yNS9nb29nbGUtYW5kLWFwcGxlLXN1cHBvcnRlZC1jb3JvbmF2aXJ1cy10cmFja2luZy1hcHBzLWxhbmQtc3RhdGVzLzM0MzUyMTQwMDEv0gEA?oc=5&hl=en-US&gl=US&ceid=US:en,"{'href': 'https://www.usatoday.com', 'title': 'USA TODAY'}",2020-08-25
Google Acquires Cloud Migration Specialist StratoZone - - Channel E2E,Google Acquires Cloud Migration Specialist StratoZone -  Channel E2E,"Tue, 25 Aug 2020 07:00:00 GMT",https://news.google.com/rss/articles/CBMiUWh0dHBzOi8vd3d3LmNoYW5uZWxlMmUuY29tL3Bvc3QvZ29vZ2xlLWJ1eXMtY2xvdWQtbWlncmF0aW9uLXNwZWNpYWxpc3Qtc3RyYXRvem9uZdIBAA?oc=5&hl=en-US&gl=US&ceid=US:en,"{'href': 'https://www.channele2e.com', 'title': 'Channel E2E'}",2020-08-25
Google Lead Form Extensions - JumpFly PPC Advertising News,Google Lead Form Extensions  JumpFly PPC Advertising News,"Tue, 25 Aug 2020 07:00:00 GMT",https://news.google.com/rss/articles/CBMiOWh0dHBzOi8vd3d3Lmp1bXBmbHkuY29tL2Jsb2cvZ29vZ2xlLWxlYWQtZm9ybS1leHRlbnNpb25zL9IBAA?oc=5&hl=en-US&gl=US&ceid=US:en,"{'href': 'https://www.jumpfly.com', 'title': 'JumpFly PPC Advertising News'}",2020-08-25
"Booking Is In, Airbnb Is Out of Google Vacation Rentals - Skift Travel News","Booking Is In, Airbnb Is Out of Google Vacation Rentals  Skift Travel News","Wed, 26 Aug 2020 07:00:00 GMT",https://news.google.com/rss/articles/CBMiVGh0dHBzOi8vc2tpZnQuY29tLzIwMjAvMDgvMjYvYm9va2luZy1pcy1pbi1haXJibmItaXMtb3V0LW9mLWdvb2dsZS12YWNhdGlvbi1yZW50YWxzL9IBWGh0dHBzOi8vc2tpZnQuY29tLzIwMjAvMDgvMjYvYm9va2luZy1pcy1pbi1haXJibmItaXMtb3V0LW9mLWdvb2dsZS12YWNhdGlvbi1yZW50YWxzL2FtcC8?oc=5&hl=en-US&gl=US&ceid=US:en,"{'href': 'https://skift.com', 'title': 'Skift Travel News'}",2020-08-25
Ex-Google employees form virtual tech 'school' for gap year students amid college closures - CNBC,Ex-Google employees form virtual tech 'school' for gap year students amid college closures  CNBC,"Mon, 24 Aug 2020 07:00:00 GMT",https://news.google.com/rss/articles/CBMiZ2h0dHBzOi8vd3d3LmNuYmMuY29tLzIwMjAvMDgvMjQvZXgtZ29vZ2xlLWVtcGxveWVlcy1mb3JtLXZpcnR1YWwtdGVjaC1zY2hvb2wtZm9yLWdhcC15ZWFyLXN0dWRlbnRzLmh0bWzSAWtodHRwczovL3d3dy5jbmJjLmNvbS9hbXAvMjAyMC8wOC8yNC9leC1nb29nbGUtZW1wbG95ZWVzLWZvcm0tdmlydHVhbC10ZWNoLXNjaG9vbC1mb3ItZ2FwLXllYXItc3R1ZGVudHMuaHRtbA?oc=5&hl=en-US&gl=US&ceid=US:en,"{'href': 'https://www.cnbc.com', 'title': 'CNBC'}",2020-08-24
"Court Issues Notice To Government, RBI In Plea Against Google Pay - NDTV","Court Issues Notice To Government, RBI In Plea Against Google Pay  NDTV","Mon, 24 Aug 2020 07:00:00 GMT",https://news.google.com/rss/articles/CBMiigFodHRwczovL3d3dy5uZHR2LmNvbS9idXNpbmVzcy9jb3VydC1pc3N1ZXMtbm90aWNlLXRvLWdvdmVybm1lbnQtcmJpLWluLXBsZWEtYWdhaW5zdC1nb29nbGUtcGF5LWZvci1hbGxlZ2VkLXZpb2xhdGlvbi1vZi1ndWlkZWxpbmVzLTIyODQ0MzPSAZABaHR0cHM6Ly93d3cubmR0di5jb20vYnVzaW5lc3MvY291cnQtaXNzdWVzLW5vdGljZS10by1nb3Zlcm5tZW50LXJiaS1pbi1wbGVhLWFnYWluc3QtZ29vZ2xlLXBheS1mb3ItYWxsZWdlZC12aW9sYXRpb24tb2YtZ3VpZGVsaW5lcy0yMjg0NDMzL2FtcC8x?oc=5&hl=en-US&gl=US&ceid=US:en,"{'href': 'https://www.ndtv.com', 'title': 'NDTV'}",2020-08-24
"Amazon Ring, Google Nest, and ADT: Which home security system ... - Vox.com","Amazon Ring, Google Nest, and ADT: Which home security system ...  Vox.com","Mon, 24 Aug 2020 07:00:00 GMT",https://news.google.com/rss/articles/CBMiS2h0dHBzOi8vd3d3LnZveC5jb20vcmVjb2RlLzIwMjAvOC8yNC8yMTM1NDYyOC9ob21lLXNlY3VyaXR5LWFkdC1nb29nbGUtcmluZ9IBAA?oc=5&hl=en-US&gl=US&ceid=US:en,"{'href': 'https://www.vox.com', 'title': 'Vox.com'}",2020-08-24
K-Internet says Google in-app payment rate hike is illegal - The Korea JoongAng Daily,K-Internet says Google in-app payment rate hike is illegal  The Korea JoongAng Daily,"Mon, 24 Aug 2020 07:00:00 GMT",https://news.google.com/rss/articles/CBMijwFodHRwczovL2tvcmVham9vbmdhbmdkYWlseS5qb2lucy5jb20vMjAyMC8wOC8yNC9idXNpbmVzcy9pbmR1c3RyeS9Hb29nbGUtS29yZWEtSW50ZXJuZXQtQ29ycG9yYXRpb25zLUFzc29jaWF0aW9uLXN0YXJ0dXAvMjAyMDA4MjQxODQxMDAzNDkuaHRtbNIBAA?oc=5&hl=en-US&gl=US&ceid=US:en,"{'href': 'https://koreajoongangdaily.joins.com', 'title': 'The Korea JoongAng Daily'}",2020-08-24
How to move your Facebook photos to Google Photos - Fast Company,How to move your Facebook photos to Google Photos  Fast Company,"Mon, 24 Aug 2020 07:00:00 GMT",https://news.google.com/rss/articles/CBMiZWh0dHBzOi8vd3d3LmZhc3Rjb21wYW55LmNvbS85MDU0MjM5Ni9sZWF2aW5nLWZhY2Vib29rLWhlcmVzLXRoZS1iZXN0LXdheS10by10YWtlLXlvdXItcGhvdG9zLXdpdGgteW910gEA?oc=5&hl=en-US&gl=US&ceid=US:en,"{'href': 'https://www.fastcompany.com', 'title': 'Fast Company'}",2020-08-24
"Google Pixel 4a 5G leak reveals dual rear cameras and, yes, a ... - TechRadar","Google Pixel 4a 5G leak reveals dual rear cameras and, yes, a ...  TechRadar","Mon, 24 Aug 2020 07:00:00 GMT",https://news.google.com/rss/articles/CBMiaWh0dHBzOi8vd3d3LnRlY2hyYWRhci5jb20vbmV3cy9nb29nbGUtcGl4ZWwtNGEtNWctbGVhay1yZXZlYWxzLWR1YWwtcmVhci1jYW1lcmFzLWFuZC15ZXMtYS1oZWFkcGhvbmUtamFja9IBAA?oc=5&hl=en-US&gl=US&ceid=US:en,"{'href': 'https://www.techradar.com', 'title': 'TechRadar'}",2020-08-24
Hackers can now use Google Drive to install malware on your ... - Komando,Hackers can now use Google Drive to install malware on your ...  Komando,"Mon, 24 Aug 2020 07:00:00 GMT",https://news.google.com/rss/articles/CBMiSmh0dHBzOi8vd3d3LmtvbWFuZG8uY29tL3NlY3VyaXR5LXByaXZhY3kvZ29vZ2xlLWRyaXZlLW1hbHdhcmUtZmxhdy83NTExMDIv0gFOaHR0cHM6Ly93d3cua29tYW5kby5jb20vc2VjdXJpdHktcHJpdmFjeS9nb29nbGUtZHJpdmUtbWFsd2FyZS1mbGF3Lzc1MTEwMi8_YW1w?oc=5&hl=en-US&gl=US&ceid=US:en,"{'href': 'https://www.komando.com', 'title': 'Komando'}",2020-08-24
"If Google's weather frog can wear a mask, so can you - The Verge","If Google's weather frog can wear a mask, so can you  The Verge","Mon, 24 Aug 2020 07:00:00 GMT",https://news.google.com/rss/articles/CBMiYWh0dHBzOi8vd3d3LnRoZXZlcmdlLmNvbS90bGRyLzIwMjAvOC8yNC8yMTM5OTUxNy9nb29nbGUtd2VhdGhlci1mcm9nLW1hc2NvdC1tYXNrLWFuZHJvaWQtY292aWQtMTnSAQA?oc=5&hl=en-US&gl=US&ceid=US:en,"{'href': 'https://www.theverge.com', 'title': 'The Verge'}",2020-08-24
Anxiety-Related Google Searches Reached A Record High During Early Stages Of The Pandemic - Forbes,Anxiety-Related Google Searches Reached A Record High During Early Stages Of The Pandemic  Forbes,"Mon, 24 Aug 2020 07:00:00 GMT",https://news.google.com/rss/articles/CBMijQFodHRwczovL3d3dy5mb3JiZXMuY29tL3NpdGVzL2VsYW5hZ3Jvc3MvMjAyMC8wOC8yNC9hbnhpZXR5LXJlbGF0ZWQtZ29vZ2xlLXNlYXJjaGVzLXJlYWNoZWQtYS1yZWNvcmQtaGlnaC1kdXJpbmctZWFybHktc3RhZ2VzLW9mLXRoZS1wYW5kZW1pYy_SAZEBaHR0cHM6Ly93d3cuZm9yYmVzLmNvbS9zaXRlcy9lbGFuYWdyb3NzLzIwMjAvMDgvMjQvYW54aWV0eS1yZWxhdGVkLWdvb2dsZS1zZWFyY2hlcy1yZWFjaGVkLWEtcmVjb3JkLWhpZ2gtZHVyaW5nLWVhcmx5LXN0YWdlcy1vZi10aGUtcGFuZGVtaWMvYW1wLw?oc=5&hl=en-US&gl=US&ceid=US:en,"{'href': 'https://www.forbes.com', 'title': 'Forbes'}",2020-08-24
"Google searches for anxiety soar to record high at beginning of coronavirus pandemic, study finds - CNBC","Google searches for anxiety soar to record high at beginning of coronavirus pandemic, study finds  CNBC","Mon, 24 Aug 2020 07:00:00 GMT",https://news.google.com/rss/articles/CBMidmh0dHBzOi8vd3d3LmNuYmMuY29tLzIwMjAvMDgvMjQvZ29vZ2xlLXNlYXJjaGVzLWZvci1hbnhpZXR5LXNvYXItdG8tcmVjb3JkLWF0LXN0YXJ0LW9mLWNvcm9uYXZpcnVzLXBhbmRlbWljLXN0dWR5Lmh0bWzSAXpodHRwczovL3d3dy5jbmJjLmNvbS9hbXAvMjAyMC8wOC8yNC9nb29nbGUtc2VhcmNoZXMtZm9yLWFueGlldHktc29hci10by1yZWNvcmQtYXQtc3RhcnQtb2YtY29yb25hdmlydXMtcGFuZGVtaWMtc3R1ZHkuaHRtbA?oc=5&hl=en-US&gl=US&ceid=US:en,"{'href': 'https://www.cnbc.com', 'title': 'CNBC'}",2020-08-24
"Google is investing $100 million in telehealth provider Amwell, which will use Google Cloud - CNBC","Google is investing $100 million in telehealth provider Amwell, which will use Google Cloud  CNBC","Mon, 24 Aug 2020 07:00:00 GMT",https://news.google.com/rss/articles/CBMiYGh0dHBzOi8vd3d3LmNuYmMuY29tLzIwMjAvMDgvMjQvZ29vZ2xlLXRvLWludmVzdC0xMDAtbWlsbGlvbi1pbi1hbXdlbGwtYXQtaXBvLWluLWNsb3VkLWRlYWwuaHRtbNIBZGh0dHBzOi8vd3d3LmNuYmMuY29tL2FtcC8yMDIwLzA4LzI0L2dvb2dsZS10by1pbnZlc3QtMTAwLW1pbGxpb24taW4tYW13ZWxsLWF0LWlwby1pbi1jbG91ZC1kZWFsLmh0bWw?oc=5&hl=en-US&gl=US&ceid=US:en,"{'href': 'https://www.cnbc.com', 'title': 'CNBC'}",2020-08-24
The labor-busting law firms and consultants that keep Google ... - The Conversation,The labor-busting law firms and consultants that keep Google ...  The Conversation,"Mon, 24 Aug 2020 07:00:00 GMT",https://news.google.com/rss/articles/CBMihgFodHRwczovL3RoZWNvbnZlcnNhdGlvbi5jb20vdGhlLWxhYm9yLWJ1c3RpbmctbGF3LWZpcm1zLWFuZC1jb25zdWx0YW50cy10aGF0LWtlZXAtZ29vZ2xlLWFtYXpvbi1hbmQtb3RoZXItd29ya3BsYWNlcy11bmlvbi1mcmVlLTE0NDI1NNIBAA?oc=5&hl=en-US&gl=US&ceid=US:en,"{'href': 'https://theconversation.com', 'title': 'The Conversation'}",2020-08-24
The 35 Best Google Sheets Keyboard Shortcuts for Mac or PC - Business Insider,The 35 Best Google Sheets Keyboard Shortcuts for Mac or PC  Business Insider,"Mon, 24 Aug 2020 07:00:00 GMT",https://news.google.com/rss/articles/CBMiTGh0dHBzOi8vd3d3LmJ1c2luZXNzaW5zaWRlci5jb20vZ3VpZGVzL3RlY2gvZ29vZ2xlLXNoZWV0cy1rZXlib2FyZC1zaG9ydGN1dHPSAQA?oc=5&hl=en-US&gl=US&ceid=US:en,"{'href': 'https://www.businessinsider.com', 'title': 'Business Insider'}",2020-08-24
Google Maps Hit by More Problems After the Latest Updates - autoevolution,Google Maps Hit by More Problems After the Latest Updates  autoevolution,"Mon, 24 Aug 2020 07:00:00 GMT",https://news.google.com/rss/articles/CBMiaGh0dHBzOi8vd3d3LmF1dG9ldm9sdXRpb24uY29tL25ld3MvZ29vZ2xlLW1hcHMtaGl0LWJ5LW1vcmUtcHJvYmxlbXMtYWZ0ZXItdGhlLWxhdGVzdC11cGRhdGVzLTE0Nzc1Ny5odG1s0gEA?oc=5&hl=en-US&gl=US&ceid=US:en,"{'href': 'https://www.autoevolution.com', 'title': 'autoevolution'}",2020-08-24
4 Reasons Why Sites May Lose Google Rankings - Search Engine Journal,4 Reasons Why Sites May Lose Google Rankings  Search Engine Journal,"Mon, 24 Aug 2020 07:00:00 GMT",https://news.google.com/rss/articles/CBMiQ2h0dHBzOi8vd3d3LnNlYXJjaGVuZ2luZWpvdXJuYWwuY29tL3doeS1zaXRlcy1sb3NlLXJhbmtpbmdzLzM3ODQ4Mi_SAQA?oc=5&hl=en-US&gl=US&ceid=US:en,"{'href': 'https://www.searchenginejournal.com', 'title': 'Search Engine Journal'}",2020-08-24
How to enable and disable location sharing in Android - The Verge,How to enable and disable location sharing in Android  The Verge,"Mon, 24 Aug 2020 07:00:00 GMT",https://news.google.com/rss/articles/CBMiXGh0dHBzOi8vd3d3LnRoZXZlcmdlLmNvbS8yMTM3MjYwMy9nb29nbGUtYW5kcm9pZC1sb2NhdGlvbi1zaGFyaW5nLW1hcHMtaG93LXRvLWVuYWJsZS1kaXNhYmxl0gEA?oc=5&hl=en-US&gl=US&ceid=US:en,"{'href': 'https://www.theverge.com', 'title': 'The Verge'}",2020-08-24
Google releases an AdMob mobile app for Android - XDA Developers,Google releases an AdMob mobile app for Android  XDA Developers,"Mon, 24 Aug 2020 07:00:00 GMT",https://news.google.com/rss/articles/CBMiP2h0dHBzOi8vd3d3LnhkYS1kZXZlbG9wZXJzLmNvbS9nb29nbGUtYWRtb2ItbW9iaWxlLWFwcC1hbmRyb2lkL9IBAA?oc=5&hl=en-US&gl=US&ceid=US:en,"{'href': 'https://www.xda-developers.com', 'title': 'XDA Developers'}",2020-08-24
Google Chrome 85 fixes WebGL code execution vulnerability - BleepingComputer,Google Chrome 85 fixes WebGL code execution vulnerability  BleepingComputer,"Mon, 24 Aug 2020 07:00:00 GMT",https://news.google.com/rss/articles/CBMiaWh0dHBzOi8vd3d3LmJsZWVwaW5nY29tcHV0ZXIuY29tL25ld3Mvc2VjdXJpdHkvZ29vZ2xlLWNocm9tZS04NS1maXhlcy13ZWJnbC1jb2RlLWV4ZWN1dGlvbi12dWxuZXJhYmlsaXR5L9IBbWh0dHBzOi8vd3d3LmJsZWVwaW5nY29tcHV0ZXIuY29tL25ld3Mvc2VjdXJpdHkvZ29vZ2xlLWNocm9tZS04NS1maXhlcy13ZWJnbC1jb2RlLWV4ZWN1dGlvbi12dWxuZXJhYmlsaXR5L2FtcC8?oc=5&hl=en-US&gl=US&ceid=US:en,"{'href': 'https://www.bleepingcomputer.com', 'title': 'BleepingComputer'}",2020-08-24
Google Maps: Person caught falling over in awkward position - what are they doing? - Express,Google Maps: Person caught falling over in awkward position - what are they doing?  Express,"Tue, 25 Aug 2020 07:00:00 GMT",https://news.google.com/rss/articles/CBMidWh0dHBzOi8vd3d3LmV4cHJlc3MuY28udWsvdHJhdmVsL2FydGljbGVzLzEzMjY5ODAvZ29vZ2xlLW1hcHMtc3RyZWV0LXZpZXctcGVyc29uLWNhdWdodC1mYWxsaW5nLW92ZXItYXdrd2FyZC1wb3NpdGlvbtIBeWh0dHBzOi8vd3d3LmV4cHJlc3MuY28udWsvdHJhdmVsL2FydGljbGVzLzEzMjY5ODAvZ29vZ2xlLW1hcHMtc3RyZWV0LXZpZXctcGVyc29uLWNhdWdodC1mYWxsaW5nLW92ZXItYXdrd2FyZC1wb3NpdGlvbi9hbXA?oc=5&hl=en-US&gl=US&ceid=US:en,"{'href': 'https://www.express.co.uk', 'title': 'Express'}",2020-08-24
What's Cooking Inside Google Research Labs In India For AI? - Analytics India Magazine,What's Cooking Inside Google Research Labs In India For AI?  Analytics India Magazine,"Mon, 24 Aug 2020 07:00:00 GMT",https://news.google.com/rss/articles/CBMiWGh0dHBzOi8vYW5hbHl0aWNzaW5kaWFtYWcuY29tL3doYXRzLWNvb2tpbmctaW5zaWRlLWdvb2dsZS1yZXNlYXJjaC1sYWJzLWluLWluZGlhLWZvci1haS_SAQA?oc=5&hl=en-US&gl=US&ceid=US:en,"{'href': 'https://analyticsindiamag.com', 'title': 'Analytics India Magazine'}",2020-08-24
How to Analyze Google's Algorithm: The Math & Skills You Need - Search Engine Journal,How to Analyze Google's Algorithm: The Math & Skills You Need  Search Engine Journal,"Mon, 24 Aug 2020 07:00:00 GMT",https://news.google.com/rss/articles/CBMiUGh0dHBzOi8vd3d3LnNlYXJjaGVuZ2luZWpvdXJuYWwuY29tL2FuYWx5emUtZ29vZ2xlLWFsZ29yaXRobS1tYXRoLXNraWxscy8zNzgyMDMv0gEA?oc=5&hl=en-US&gl=US&ceid=US:en,"{'href': 'https://www.searchenginejournal.com', 'title': 'Search Engine Journal'}",2020-08-24
"Cukup Foto, Google Lens Bisa Selesaikan PR Matematika Kamu - CNBC Indonesia","Cukup Foto, Google Lens Bisa Selesaikan PR Matematika Kamu  CNBC Indonesia","Mon, 24 Aug 2020 07:00:00 GMT",https://news.google.com/rss/articles/CBMidWh0dHBzOi8vd3d3LmNuYmNpbmRvbmVzaWEuY29tL3RlY2gvMjAyMDA4MjQxNzUwNDUtMzctMTgxNjE4L2N1a3VwLWZvdG8tZ29vZ2xlLWxlbnMtYmlzYS1zZWxlc2Fpa2FuLXByLW1hdGVtYXRpa2Eta2FtddIBAA?oc=5&hl=en-US&gl=US&ceid=US:en,"{'href': 'https://www.cnbcindonesia.com', 'title': 'CNBC Indonesia'}",2020-08-24
Google Play Store Alternatives 2023 - TechEngage,Google Play Store Alternatives 2023  TechEngage,"Mon, 24 Aug 2020 07:00:00 GMT",https://news.google.com/rss/articles/CBMiNmh0dHBzOi8vdGVjaGVuZ2FnZS5jb20vZ29vZ2xlLXBsYXktc3RvcmUtYWx0ZXJuYXRpdmVzL9IBAA?oc=5&hl=en-US&gl=US&ceid=US:en,"{'href': 'https://techengage.com', 'title': 'TechEngage'}",2020-08-24
Google Pixel 4a review: Android's no-brainer | nextpit - NextPit International,Google Pixel 4a review: Android's no-brainer | nextpit  NextPit International,"Mon, 24 Aug 2020 07:00:00 GMT",https://news.google.com/rss/articles/CBMiLmh0dHBzOi8vd3d3Lm5leHRwaXQuY29tL2dvb2dsZS1waXhlbC00YS1yZXZpZXfSAQA?oc=5&hl=en-US&gl=US&ceid=US:en,"{'href': 'https://www.nextpit.com', 'title': 'NextPit International'}",2020-08-24
兩款Google 裝置現身FCC，Sabrina 是你嗎？ - 電腦王阿達,兩款Google 裝置現身FCC，Sabrina 是你嗎？  電腦王阿達,"Mon, 24 Aug 2020 07:00:00 GMT",https://news.google.com/rss/articles/CBMiKGh0dHBzOi8vd3d3LmtvY3BjLmNvbS50dy9hcmNoaXZlcy8zNDAwMznSAQA?oc=5&hl=en-US&gl=US&ceid=US:en,"{'href': 'https://www.kocpc.com.tw', 'title': '電腦王阿達'}",2020-08-24
Google поздравил Украину с Днем независимости - zavtra.com.ua,Google поздравил Украину с Днем независимости  zavtra.com.ua,"Mon, 24 Aug 2020 07:00:00 GMT",https://news.google.com/rss/articles/CBMiT2h0dHBzOi8vemF2dHJhLmNvbS51YS8yMDIwLzA4LzI0L2dvb2dsZS1wb3pkcmF2aWwtdWtyYWludS1zLWRuZW0tbmV6YXZpc2ltb3N0aS_SAVNodHRwczovL3phdnRyYS5jb20udWEvMjAyMC8wOC8yNC9nb29nbGUtcG96ZHJhdmlsLXVrcmFpbnUtcy1kbmVtLW5lemF2aXNpbW9zdGkvYW1wLw?oc=5&hl=en-US&gl=US&ceid=US:en,"{'href': 'https://zavtra.com.ua', 'title': 'zavtra.com.ua'}",2020-08-24
Google to switch PH BPO partner following online scam - Rappler,Google to switch PH BPO partner following online scam  Rappler,"Mon, 24 Aug 2020 07:00:00 GMT",https://news.google.com/rss/articles/CBMiU2h0dHBzOi8vd3d3LnJhcHBsZXIuY29tL3RlY2hub2xvZ3kvZ29vZ2xlLXN3aXRjaC1icG8tcGFydG5lci1mb2xsb3dpbmctb25saW5lLXNjYW0v0gEA?oc=5&hl=en-US&gl=US&ceid=US:en,"{'href': 'https://www.rappler.com', 'title': 'Rappler'}",2020-08-23
Pixel 5 leak reveals how Google will fix worst thing about Pixel 4 - Tom's Guide,Pixel 5 leak reveals how Google will fix worst thing about Pixel 4  Tom's Guide,"Sun, 23 Aug 2020 07:00:00 GMT",https://news.google.com/rss/articles/CBMiY2h0dHBzOi8vd3d3LnRvbXNndWlkZS5jb20vbmV3cy9nb29nbGUtcGl4ZWwtNS1hbmQtcGl4ZWwtNGEtNWctcGhvdG8tbGVha3MtYW5kLXRoZXJlcy1hLWh1Z2UtdXBncmFkZdIBAA?oc=5&hl=en-US&gl=US&ceid=US:en,"{'href': 'https://www.tomsguide.com', 'title': ""Tom's Guide""}",2020-08-23
Google Maps: Street view catches man in awkward position - what’s wrong with his shorts? - Express,Google Maps: Street view catches man in awkward position - what’s wrong with his shorts?  Express,"Sun, 23 Aug 2020 07:00:00 GMT",https://news.google.com/rss/articles/CBMidWh0dHBzOi8vd3d3LmV4cHJlc3MuY28udWsvdHJhdmVsL2FydGljbGVzLzEzMjY1MDkvR29vZ2xlLU1hcHMtU3RyZWV0LVZpZXctdmlyYWwtcGhvdG8tbWFuLXNob3J0cy1Db3VudHktQ2xhcmUtSXJlbGFuZNIBeWh0dHBzOi8vd3d3LmV4cHJlc3MuY28udWsvdHJhdmVsL2FydGljbGVzLzEzMjY1MDkvR29vZ2xlLU1hcHMtU3RyZWV0LVZpZXctdmlyYWwtcGhvdG8tbWFuLXNob3J0cy1Db3VudHktQ2xhcmUtSXJlbGFuZC9hbXA?oc=5&hl=en-US&gl=US&ceid=US:en,"{'href': 'https://www.express.co.uk', 'title': 'Express'}",2020-08-23
How to Use Google Maps on a Samsung Galaxy Smartwatch - How-To Geek,How to Use Google Maps on a Samsung Galaxy Smartwatch  How-To Geek,"Sun, 23 Aug 2020 07:00:00 GMT",https://news.google.com/rss/articles/CBMiV2h0dHBzOi8vd3d3Lmhvd3RvZ2Vlay5jb20vNjg1OTMxL2hvdy10by11c2UtZ29vZ2xlLW1hcHMtb24tYS1zYW1zdW5nLWdhbGF4eS1zbWFydHdhdGNoL9IBAA?oc=5&hl=en-US&gl=US&ceid=US:en,"{'href': 'https://www.howtogeek.com', 'title': 'How-To Geek'}",2020-08-23
Autofill with Google now allows biometric authentication for all ... - Digital Information World,Autofill with Google now allows biometric authentication for all ...  Digital Information World,"Sun, 23 Aug 2020 07:00:00 GMT",https://news.google.com/rss/articles/CBMiiAFodHRwczovL3d3dy5kaWdpdGFsaW5mb3JtYXRpb253b3JsZC5jb20vMjAyMC8wOC9hdXRvZmlsbC13aXRoLWdvb2dsZS1ub3ctYWxsb3dzLWJpb21ldHJpYy1hdXRoZW50aWNhdGlvbi1mb3ItYWxsLWFuZHJvaWQtMTAtZGV2aWNlcy5odG1s0gEA?oc=5&hl=en-US&gl=US&ceid=US:en,"{'href': 'https://www.digitalinformationworld.com', 'title': 'Digital Information World'}",2020-08-23
2020 Search Engine Market Share: Google Leads by a Huge Margin! - Digital Information World,2020 Search Engine Market Share: Google Leads by a Huge Margin!  Digital Information World,"Mon, 24 Aug 2020 07:00:00 GMT",https://news.google.com/rss/articles/CBMicmh0dHBzOi8vd3d3LmRpZ2l0YWxpbmZvcm1hdGlvbndvcmxkLmNvbS8yMDIwLzA4LzIwMjAtc2VhcmNoLWVuZ2luZS1tYXJrZXQtc2hhcmUtZ29vZ2xlLWxlYWRzLWJ5LWEtaHVnZS1tYXJnaW4uaHRtbNIBAA?oc=5&hl=en-US&gl=US&ceid=US:en,"{'href': 'https://www.digitalinformationworld.com', 'title': 'Digital Information World'}",2020-08-23
Google delivers four initiatives to support inclusive distance learning ... - Manila Bulletin,Google delivers four initiatives to support inclusive distance learning ...  Manila Bulletin,"Mon, 24 Aug 2020 07:00:00 GMT",https://news.google.com/rss/articles/CBMieGh0dHBzOi8vbWIuY29tLnBoLzIwMjAvMDgvMjQvZ29vZ2xlLWRlbGl2ZXJzLWZvdXItaW5pdGlhdGl2ZXMtdG8tc3VwcG9ydC1pbmNsdXNpdmUtZGlzdGFuY2UtbGVhcm5pbmctaW4tdGhlLXBoaWxpcHBpbmVzL9IBAA?oc=5&hl=en-US&gl=US&ceid=US:en,"{'href': 'https://mb.com.ph', 'title': 'Manila Bulletin'}",2020-08-23
"Google Drive, Google Fotos & GMail: So könnt ihr viel Speicherplatz sparen und überflüssige Daten löschen - GoogleWatchBlog","Google Drive, Google Fotos & GMail: So könnt ihr viel Speicherplatz sparen und überflüssige Daten löschen  GoogleWatchBlog","Mon, 24 Aug 2020 07:00:00 GMT",https://news.google.com/rss/articles/CBMiTmh0dHBzOi8vd3d3Lmdvb2dsZXdhdGNoYmxvZy5kZS8yMDIwLzA4L2dvb2dsZS1kcml2ZS1mb3Rvcy1nbWFpbC1zcGVpY2hlcnBsYXR6L9IBUmh0dHBzOi8vd3d3Lmdvb2dsZXdhdGNoYmxvZy5kZS8yMDIwLzA4L2dvb2dsZS1kcml2ZS1mb3Rvcy1nbWFpbC1zcGVpY2hlcnBsYXR6L2FtcC8?oc=5&hl=en-US&gl=US&ceid=US:en,"{'href': 'https://www.googlewatchblog.de', 'title': 'GoogleWatchBlog'}",2020-08-23
